,author_id,tweet_id,time,text,metrics,tweet_url,images
0,51016460,1521124931303485441,2022-05-02 13:50:19+00:00,@egomezart ..y quiz치s pierda alguno.,"{'retweet_count': 0, 'reply_count': 0, 'like_count': 0, 'quote_count': 0}",https://twitter.com/i/web/status/1521124931303485441,
1,51016460,1521123982241452032,2022-05-02 13:46:33+00:00,"El de ayer debe haber sido el primer acto de 1o de Mayo de una central sindical uruguaya, que, coincidiendo con una guerra de agresi칩n en Europa que involucra a una de las dos superpotencias militares, no incluy칩 ninguna referencia a ese hecho que impacta al mundo entero.","{'retweet_count': 37, 'reply_count': 12, 'like_count': 181, 'quote_count': 1}",https://twitter.com/i/web/status/1521123982241452032,
2,51016460,1521122717033897984,2022-05-02 13:41:31+00:00,Ucrania lleva su guerra defensiva a territorio ruso. https://t.co/zLOe3UpeHV,"{'retweet_count': 2, 'reply_count': 1, 'like_count': 6, 'quote_count': 0}",https://twitter.com/i/web/status/1521122717033897984,
3,51016460,1521100839297118208,2022-05-02 12:14:35+00:00,"No se puede invocar la representaci칩n de ""los trabajadores"", cuando expl칤citamente se reconoce que s칩lo se representa a los afiliados al sindicato. https://t.co/NrmyCNqRIA","{'retweet_count': 14, 'reply_count': 11, 'like_count': 27, 'quote_count': 1}",https://twitter.com/i/web/status/1521100839297118208,
4,51016460,1521100299389218817,2022-05-02 12:12:26+00:00,@WASHINGTONGALV5 Fingiendo creer que son entidades diferentes,"{'retweet_count': 0, 'reply_count': 0, 'like_count': 0, 'quote_count': 0}",https://twitter.com/i/web/status/1521100299389218817,
5,51016460,1521096352452673537,2022-05-02 11:56:45+00:00,"쮸caso esperaba un ""mea culpa"" por haber pedido una cuarentena estricta durante la pandemia, o un aplauso al gobierno por haber mantenido en pie el aparato productivo del pa칤s? https://t.co/H8KrUQ1Sql","{'retweet_count': 12, 'reply_count': 6, 'like_count': 68, 'quote_count': 1}",https://twitter.com/i/web/status/1521096352452673537,{'media_keys': ['3_1521096349978091521']}
6,51016460,1520952723465592832,2022-05-02 02:26:01+00:00,"Nadie cree en la separaci칩n del pitcnt y el FA, empezando por los que asisten a sus actos, bajo la ficci칩n de que no son actos pol칤tico partidarios, que es lo que son. Y que todos saben que lo son. https://t.co/DjjMuaMmkj","{'retweet_count': 4, 'reply_count': 1, 'like_count': 15, 'quote_count': 1}",https://twitter.com/i/web/status/1520952723465592832,
7,51016460,1520932209590382593,2022-05-02 01:04:30+00:00,"El Sunca no hizo paro por su muerte. 
Tuvieron que pasar cuatro meses para que esta noticia llegara a conocimiento de la opini칩n p칰blica. 
Muy triste por donde se lo mire. https://t.co/jZxI1zAhsJ","{'retweet_count': 66, 'reply_count': 25, 'like_count': 199, 'quote_count': 3}",https://twitter.com/i/web/status/1520932209590382593,
8,51016460,1520903044157870081,2022-05-01 23:08:37+00:00,@Alfredo_Bruno @ACuadra_do Lo ins칩lito es que ese hecho milagroso no haya hecho mella en su conocido agnosticismo.,"{'retweet_count': 0, 'reply_count': 1, 'like_count': 0, 'quote_count': 0}",https://twitter.com/i/web/status/1520903044157870081,
9,51016460,1520902215455674372,2022-05-01 23:05:19+00:00,"""Qu칠 linda complicidad....""
Pero antes de eso se escucha n칤tidamente un insulto a la madre de la trabajadora muerta.
""Empat칤a"" hasta que queda al descubierto lo que deb칤a permanecer oculto.
Verg칲enza. https://t.co/c3YZIBRded","{'retweet_count': 67, 'reply_count': 15, 'like_count': 157, 'quote_count': 3}",https://twitter.com/i/web/status/1520902215455674372,
10,51016460,1520896903025553410,2022-05-01 22:44:13+00:00,"@Rodri_Zeballos @DrFLuquez ""Valid칩"" algo que el ni침o no pregunt칩. Es tan absurdo como el intento de justificarlo","{'retweet_count': 1, 'reply_count': 1, 'like_count': 4, 'quote_count': 0}",https://twitter.com/i/web/status/1520896903025553410,
11,51016460,1520896273066340353,2022-05-01 22:41:43+00:00,@Alfredo_Bruno @ACuadra_do Los milagros ocurren. Peronia es algo fuera de serie,"{'retweet_count': 0, 'reply_count': 1, 'like_count': 2, 'quote_count': 0}",https://twitter.com/i/web/status/1520896273066340353,
12,51016460,1520879182850396162,2022-05-01 21:33:48+00:00,Varios siglos de historia sobre el expansionismo ruso resumidos por el profesor @DDelgrossi https://t.co/aANHN6UJ4x,"{'retweet_count': 2, 'reply_count': 1, 'like_count': 11, 'quote_count': 0}",https://twitter.com/i/web/status/1520879182850396162,
13,51016460,1520878523753271296,2022-05-01 21:31:11+00:00,游뱎游뱎游뱎游뱎游뱎 https://t.co/2QLo6lH8b3,"{'retweet_count': 6, 'reply_count': 0, 'like_count': 12, 'quote_count': 1}",https://twitter.com/i/web/status/1520878523753271296,
14,51016460,1520878000706711552,2022-05-01 21:29:06+00:00,"En Chile, el ""No"" al proyecto de Constituci칩n que admite a ""ciudadanos y ciudadanas de nuestro pa칤s que est치n ejerciendo su derecho a manifestarse como delincuentes"" aventaja por 10 puntos a los partidarios del ""Si"" https://t.co/GNCtCsvxuS","{'retweet_count': 3, 'reply_count': 1, 'like_count': 12, 'quote_count': 0}",https://twitter.com/i/web/status/1520878000706711552,
15,51016460,1520876473933987840,2022-05-01 21:23:02+00:00,Mundo f칰tbol pitcnt. https://t.co/xYOOdgEPY6,"{'retweet_count': 2, 'reply_count': 0, 'like_count': 7, 'quote_count': 0}",https://twitter.com/i/web/status/1520876473933987840,
16,51016460,1520869656000483329,2022-05-01 20:55:57+00:00,"@yoystik Falta que ahora lo sientan en los votos.
De eso se trata.","{'retweet_count': 0, 'reply_count': 0, 'like_count': 3, 'quote_count': 0}",https://twitter.com/i/web/status/1520869656000483329,
17,51016460,1520857230123278336,2022-05-01 20:06:34+00:00,"@rodrigo_tisnes Nunca te pregunt칠 tu opini칩n. 
Te sentiste convocado a darla al leer que en este d칤a recuerdo a los trabajadores asesinados en Ucrania por los bombardeos de Putin. 
Algo te movi칩 a tomar distancia de ese criminal, escud치ndote en otros bombardeos.","{'retweet_count': 0, 'reply_count': 0, 'like_count': 0, 'quote_count': 0}",https://twitter.com/i/web/status/1520857230123278336,
18,51016460,1520834163242414080,2022-05-01 18:34:54+00:00,"@JDAVIDGUANCO Usted hable con sus hijos de lo que se le d칠 la gana. 
Pero mejor no meterse con los hijos de los dem치s.","{'retweet_count': 0, 'reply_count': 0, 'like_count': 2, 'quote_count': 0}",https://twitter.com/i/web/status/1520834163242414080,
19,51016460,1520832940179353605,2022-05-01 18:30:03+00:00,"Un poquito de libertad de expresi칩n est치 bien.
Pero cuando se meten con ""la comisi칩n de g칠nero del pitcnt "" se termin칩 la paciencia. https://t.co/e6rFG9munh","{'retweet_count': 213, 'reply_count': 45, 'like_count': 652, 'quote_count': 2}",https://twitter.com/i/web/status/1520832940179353605,
20,51016460,1520818015620632576,2022-05-01 17:30:45+00:00,"@MVanRompaey @LagoAli Le dice algo que no le pregunt칩. Tambi칠n podr칤a haber acotado que podr칤a no casarse con nadie. O si viajaba a un pa칤s musumlm치n, casarse con varias mujeres","{'retweet_count': 0, 'reply_count': 0, 'like_count': 3, 'quote_count': 0}",https://twitter.com/i/web/status/1520818015620632576,
21,51016460,1520810142677168128,2022-05-01 16:59:27+00:00,"@NestorMillan14 Un atrevido, que ahora puede amplificar sus idioteces a trav칠s de canal 10.
Eso si. Es tan cag칩n que por la televisi칩n no se anima a abrir la boca para insultarme","{'retweet_count': 0, 'reply_count': 0, 'like_count': 2, 'quote_count': 0}",https://twitter.com/i/web/status/1520810142677168128,
22,51016460,1520804945238188033,2022-05-01 16:38:48+00:00,"@Rodri_Zeballos @DrFLuquez @pichurod ""Valid칩 una alternativa"" que el ni침o no le pidi칩.","{'retweet_count': 1, 'reply_count': 2, 'like_count': 1, 'quote_count': 0}",https://twitter.com/i/web/status/1520804945238188033,
23,51016460,1520804488449200128,2022-05-01 16:36:59+00:00,"@NestorMillan14 Idiota, y cag칩n, porque lo borr칩. 
Canal 10 gasta plata en un imb칠cil de altos quilates. Y cobarde.","{'retweet_count': 0, 'reply_count': 1, 'like_count': 3, 'quote_count': 0}",https://twitter.com/i/web/status/1520804488449200128,
24,51016460,1520804036114468865,2022-05-01 16:35:12+00:00,"-Cuando sea grande, me voy a casar con una nena. 
-...o con un nene.
- Cuando sea grande voy a jugar en Pe침arol. 
-...o en River, o Bella Vista, o Nacional 
- Cuando sea grande voy a ser bombero 
-...o trompetista, plomero, m칠dico, mec치nico 
Y todo as칤. 
Educando a los ni침os.","{'retweet_count': 3, 'reply_count': 3, 'like_count': 28, 'quote_count': 0}",https://twitter.com/i/web/status/1520804036114468865,
25,51016460,1520803247908433928,2022-05-01 16:32:04+00:00,"@NestorMillan14 Un gran idiota financiado por canal 10.
Si este imb칠cil tiene alg칰n problema conmigo, sabe que no es dif칤cil encontrarme para discutirlo personalmente.","{'retweet_count': 2, 'reply_count': 1, 'like_count': 12, 'quote_count': 0}",https://twitter.com/i/web/status/1520803247908433928,
26,51016460,1520802802565476352,2022-05-01 16:30:17+00:00,"@rodrigo_tisnes No me interesa tu opini칩n sobre Putin. Lamento herir el alto concepto que tienes de t칤 mismo. 
S칩lo quer칤a recordar el genocidio que en silencio (al menos en los medios uruguayos) est치 perpetrando Rusia liderada por Putin, en Ucrania.","{'retweet_count': 0, 'reply_count': 1, 'like_count': 0, 'quote_count': 0}",https://twitter.com/i/web/status/1520802802565476352,
27,51016460,1520802318299500545,2022-05-01 16:28:22+00:00,"@rodrigo_tisnes Rusia es la de siempre. 
El Partido Comunista fue un invento genial para romper el encierro ruso, con el disfraz de una ideolog칤a religiosa que sigue capturando fieles, un siglo despu칠s.","{'retweet_count': 0, 'reply_count': 0, 'like_count': 0, 'quote_count': 0}",https://twitter.com/i/web/status/1520802318299500545,
28,51016460,1520795513079037957,2022-05-01 16:01:19+00:00,"@Rodri_Zeballos @DrFLuquez @pichurod El comentario que el ni침o no le pidi칩. 
El Estado convertido en asesor matrimonial de ni침o de 5 a침os.
Si no fuera pat칠tico, ser칤a hasta c칩mico.","{'retweet_count': 0, 'reply_count': 1, 'like_count': 0, 'quote_count': 0}",https://twitter.com/i/web/status/1520795513079037957,
29,51016460,1520795090783940608,2022-05-01 15:59:39+00:00,"@hdeaurre @beaqt_importa Pero el ni침o no se la pidi칩. 
Si el ni침o le dice que es de Pe침srol, la maestra le tendr칤a que decir que tambi칠n piede ser de Rentistas, Cerro,  Bella Vista, Nacional...
Qu칠 nivel!","{'retweet_count': 0, 'reply_count': 1, 'like_count': 0, 'quote_count': 0}",https://twitter.com/i/web/status/1520795090783940608,
30,51016460,1520794689602875392,2022-05-01 15:58:03+00:00,"@rodrigo_tisnes Todo sea por defender la masacre del ex KGB, y amo de las franquicias comunistas en el resto del mundo","{'retweet_count': 0, 'reply_count': 2, 'like_count': 0, 'quote_count': 0}",https://twitter.com/i/web/status/1520794689602875392,
31,51016460,1520790168499896320,2022-05-01 15:40:05+00:00,"@rodrigo_tisnes ""Ah..pero el bombardeo a Yemen.."".
Eso si es un argumento!","{'retweet_count': 0, 'reply_count': 1, 'like_count': 1, 'quote_count': 0}",https://twitter.com/i/web/status/1520790168499896320,
32,51016460,1520789623252914176,2022-05-01 15:37:55+00:00,"@yoystik @GastonSilveir11 Silencio. 
El compa침ero cometi칩 un error. 
Cosas que pasan","{'retweet_count': 0, 'reply_count': 0, 'like_count': 1, 'quote_count': 0}",https://twitter.com/i/web/status/1520789623252914176,
33,51016460,1520783280588529664,2022-05-01 15:12:43+00:00,@rodrigo_tisnes El truco de esconder la simpat칤a por el genocidio en Ucrania invocando el ataque saud칤 a Yemen no estar칤a funcionando.,"{'retweet_count': 0, 'reply_count': 1, 'like_count': 0, 'quote_count': 0}",https://twitter.com/i/web/status/1520783280588529664,
34,51016460,1520782122469912576,2022-05-01 15:08:07+00:00,"@rodrigo_tisnes Obvio!
Bienvenido al mundo real.
El Partido Comunista lo que hizo fue expandir a nivel planetario el inter칠s de Rusia. 
Y precisamente....aqu칤 est치n los prorusos callados ante el genocidio en Ucrania.","{'retweet_count': 0, 'reply_count': 1, 'like_count': 0, 'quote_count': 0}",https://twitter.com/i/web/status/1520782122469912576,
35,51016460,1520780948723224576,2022-05-01 15:03:27+00:00,"@hdeaurre @beaqt_importa Con su criterio, podr칤a haberle dicho tambi칠n que pod칤a permanecer soltero...","{'retweet_count': 0, 'reply_count': 1, 'like_count': 0, 'quote_count': 0}",https://twitter.com/i/web/status/1520780948723224576,
36,51016460,1520780798432972800,2022-05-01 15:02:51+00:00,@hdeaurre @beaqt_importa Pero el ni침o no le pidi칩 opini칩n. Expres칩 su proyecto de vida.,"{'retweet_count': 0, 'reply_count': 0, 'like_count': 0, 'quote_count': 0}",https://twitter.com/i/web/status/1520780798432972800,
37,51016460,1520780511051845633,2022-05-01 15:01:43+00:00,"@rodrigo_tisnes Lo raro es que siendo Putin una especie de versi칩n rusa de Cabildo Abierto, seg칰n su opini칩n, se mantenga ese f칠rreo y vergonzoso silencio. 
Doblemente inentendible.","{'retweet_count': 0, 'reply_count': 0, 'like_count': 0, 'quote_count': 0}",https://twitter.com/i/web/status/1520780511051845633,
38,51016460,1520780173120917504,2022-05-01 15:00:22+00:00,@rodrigo_tisnes El silencio ante la agresi칩n contra Ucrania demuestra la sumisi칩n ideol칩gica de la izquierda uruguaya respecto de los perpetradores del genocidio ruso en ese pa칤s soberano.,"{'retweet_count': 0, 'reply_count': 2, 'like_count': 0, 'quote_count': 0}",https://twitter.com/i/web/status/1520780173120917504,
39,51016460,1520778186895740928,2022-05-01 14:52:29+00:00,"@rodrigo_tisnes El cinismo ideol칩gico de los admiradores de Putin los lleva a maquillar su adhesi칩n a la guerra contra Ucrania, recordando otras guerras. Eso explica mejor el silencio de los admiradores del ex imperio sovi칠tico, que renace en el sue침o anexionista de Putin","{'retweet_count': 0, 'reply_count': 2, 'like_count': 1, 'quote_count': 0}",https://twitter.com/i/web/status/1520778186895740928,
40,51016460,1520774921130979328,2022-05-01 14:39:30+00:00,"Personas obnubiladas por su fanatismo ideol칩gico creen que es obligaci칩n de las maestras o del Estado opinar sobre el deseo de un ni침o de casarse en su vida adulta con un var칩n o una ni침a.
A eso hemos llegado.
La decadencia moral e intelectual en su m치s alta expresi칩n.","{'retweet_count': 53, 'reply_count': 14, 'like_count': 304, 'quote_count': 1}",https://twitter.com/i/web/status/1520774921130979328,
41,51016460,1520773947993706496,2022-05-01 14:35:38+00:00,"@hdeaurre @beaqt_importa No es ninguna obligaci칩n de la maestra ni de nadie opinar sobre las elecciones de un ni침o, salvo que su proyecto de vida consista en convertirse en ladr칩n de bancos, narcotraficante, terrorista o sicario.","{'retweet_count': 0, 'reply_count': 1, 'like_count': 0, 'quote_count': 0}",https://twitter.com/i/web/status/1520773947993706496,
42,51016460,1520773366243684352,2022-05-01 14:33:19+00:00,"Cuando los trabajadores muertos por los bombardeos de Putin le provocan carcajadas a quienes dicen hablar en su nombre. 
游뱙游뱙游뱙游뱙游뱙游뱙游뱙游뱙游뱙 https://t.co/LU82VRkWwW","{'retweet_count': 8, 'reply_count': 1, 'like_count': 29, 'quote_count': 0}",https://twitter.com/i/web/status/1520773366243684352,{'media_keys': ['3_1520773363060383744']}
43,51016460,1520772582684827648,2022-05-01 14:30:12+00:00,"Hi @elonmusk .
We have decided, using Twitter, the menu of #ElTuirazo2: barbacue !
Save the date: 5-6 November, Montevideo, Uruguay. https://t.co/5hj64FlDy8","{'retweet_count': 1, 'reply_count': 0, 'like_count': 7, 'quote_count': 0}",https://twitter.com/i/web/status/1520772582684827648,{'media_keys': ['3_1520772579845419008']}
44,51016460,1520767063542820864,2022-05-01 14:08:17+00:00,"@criticamj1 Es un error. Pero a la vez una gran oportunidad para generar desde aqu칤, con 칠ste y otros instrumentos que estamos proyectando, un movimiento de la sociedad a favor de estos cambios.","{'retweet_count': 0, 'reply_count': 0, 'like_count': 1, 'quote_count': 0}",https://twitter.com/i/web/status/1520767063542820864,
45,51016460,1520766134999420928,2022-05-01 14:04:35+00:00,"@criticamj1 Sobre las cisas de fondo, siempre encontramos silencio de las autoridades. 
Lo lamento porque las redes sociales son el 치mbito m치s democr치tico para debatir sobre estos asuntos. 
En lo personal, esa indiferencia refuerza m치s mi prop칩sito de insistir sobre estos temas.","{'retweet_count': 0, 'reply_count': 1, 'like_count': 0, 'quote_count': 0}",https://twitter.com/i/web/status/1520766134999420928,
46,51016460,1520765537818603520,2022-05-01 14:02:13+00:00,"@LISSIDINI1 Insisto en que esa tarea no puede interferir en la libre elecci칩n de los proyectos l칤citos del ni침o, y mucho menos en el derecho de las familias a decidir sobre la educaci칩n de sus hijos. 
La armon칤a social depender치 de respetar ese justo equilibrio.","{'retweet_count': 0, 'reply_count': 1, 'like_count': 0, 'quote_count': 0}",https://twitter.com/i/web/status/1520765537818603520,
47,51016460,1520764658952511488,2022-05-01 13:58:43+00:00,"Un recuerdo especial hoy para los trabajadores de Ucrania, muertos por los bombardeos de Putin.","{'retweet_count': 70, 'reply_count': 21, 'like_count': 375, 'quote_count': 3}",https://twitter.com/i/web/status/1520764658952511488,
48,51016460,1520761333548929024,2022-05-01 13:45:30+00:00,"@LISSIDINI1 La escuela debe detenerse ante los sue침os y proyectos del ni침o. Salvo que los mismos consistan en convertirse en un sicario, en un narcotraficante, o en un ladr칩n. 
Si desea casarse con un var칩n o una nena, no es un asunto sobre el que la escuela deba opinar.","{'retweet_count': 0, 'reply_count': 1, 'like_count': 0, 'quote_count': 0}",https://twitter.com/i/web/status/1520761333548929024,
49,51016460,1520760228827987968,2022-05-01 13:41:07+00:00,"El primer deber del Estado es garantizar los derechos y libertades de los ciudadanos, bajo la constante amenaza de una delincuencia asesina, que por momento parece fuera de control. https://t.co/BoLs9ZYiVa","{'retweet_count': 9, 'reply_count': 6, 'like_count': 19, 'quote_count': 0}",https://twitter.com/i/web/status/1520760228827987968,
50,51016460,1520759280789377025,2022-05-01 13:37:21+00:00,"Acarreo kirchnerista.
El principal trabajo de esa organizaci칩n que se apoder칩 del Estado argentino, consiste en eso. https://t.co/QMC0BAYE6A","{'retweet_count': 1, 'reply_count': 2, 'like_count': 7, 'quote_count': 0}",https://twitter.com/i/web/status/1520759280789377025,
51,51016460,1520756885346865153,2022-05-01 13:27:50+00:00,"@dmgarcia94 Existen leyes que, dn determinados casos, permiten quitar la patria potestad","{'retweet_count': 0, 'reply_count': 0, 'like_count': 0, 'quote_count': 0}",https://twitter.com/i/web/status/1520756885346865153,
52,51016460,1520754998472175616,2022-05-01 13:20:20+00:00,"@LISSIDINI1 Lo que est치 en juego, a mi juicio (me puedo equivocar, claro), es qui칠n decide los grandes lineamientos de la educaci칩n de los ni침os: la familia o el Estado.","{'retweet_count': 0, 'reply_count': 1, 'like_count': 0, 'quote_count': 0}",https://twitter.com/i/web/status/1520754998472175616,
53,51016460,1520754584934752256,2022-05-01 13:18:41+00:00,"@LISSIDINI1 El cambio social es una constante en la historia de la humanidad. Las creencias colectivas no son inmutables.
No hay etiquetas ni intenciones aviesas q logren el objetivo imposible de penetrar la mente humana para congelar la raz칩n.
Siempre seguiremos pensando hasta el 칰ltimo d칤a","{'retweet_count': 0, 'reply_count': 0, 'like_count': 0, 'quote_count': 0}",https://twitter.com/i/web/status/1520754584934752256,
54,51016460,1520751554189357057,2022-05-01 13:06:39+00:00,"@LISSIDINI1 Aceptada entonces la existencia de la ""ideolog칤a de g칠nero"", entendida como un conjunto de ideas, creencias y enfoques sobre la naturaleza del ser humano y sus proyectos de vida, bucear sobre qui칠n le puso ese nombre no me resulta relevante.","{'retweet_count': 0, 'reply_count': 1, 'like_count': 0, 'quote_count': 0}",https://twitter.com/i/web/status/1520751554189357057,
55,51016460,1520750632742707200,2022-05-01 13:02:59+00:00,"El hombre se eleva y se dignifica por el trabajo, comenzando por el que realiza sobre s칤 mismo, para poder ser m치s 칰til a la sociedad, dejando por el camino sus imperfecciones. 
En este d칤a, un recuerdo para quienes nos ense침aron lo que necesitamos para recorrer ese camino.","{'retweet_count': 12, 'reply_count': 2, 'like_count': 73, 'quote_count': 0}",https://twitter.com/i/web/status/1520750632742707200,
56,51016460,1520747567142768640,2022-05-01 12:50:48+00:00,"@Alfredo_Bruno Ninguna novedad. Eso ya lo ense침aba nuestro profeta de Rinc칩n del Cerro, se침alando el modelo de vida de una tribu africana,  afecta al chusmer칤o y reacia a las 8 horas.","{'retweet_count': 2, 'reply_count': 2, 'like_count': 19, 'quote_count': 0}",https://twitter.com/i/web/status/1520747567142768640,
57,51016460,1520747101025562625,2022-05-01 12:48:57+00:00,"@LISSIDINI1 Es debatible, como cualquier creaci칩n intelectual. 
Y si es debatible, es porque existe.","{'retweet_count': 0, 'reply_count': 1, 'like_count': 0, 'quote_count': 0}",https://twitter.com/i/web/status/1520747101025562625,
58,51016460,1520745942449680384,2022-05-01 12:44:21+00:00,"@831Land Fecha: entre 5 y 6 de noviembre. 
Lugar: Montevideo.","{'retweet_count': 0, 'reply_count': 1, 'like_count': 2, 'quote_count': 0}",https://twitter.com/i/web/status/1520745942449680384,
59,51016460,1520744513131532289,2022-05-01 12:38:40+00:00,"@dmgarcia94 Y desde cu치ndo se necesita al Estado (suponiendo que la maestra lo fuera de una escuela estatal, lo que ignoro) para decirle a los ni침os que pueden escoger su modo de vida. Ese es un derecho natural. Es anterior al Estado.","{'retweet_count': 0, 'reply_count': 0, 'like_count': 1, 'quote_count': 0}",https://twitter.com/i/web/status/1520744513131532289,
60,51016460,1520743610928406528,2022-05-01 12:35:05+00:00,"Es muy rico el intercambio generado por mi post sobre la maestra que le se침ala al ni침o q de adulto desea casarse con una chica, que quiz치s tambi칠n lo haga con un chico.
Tal vez estemos en presencia de la batalla final entre el Estado y las familias sobre la educaci칩n de los ni침os","{'retweet_count': 33, 'reply_count': 21, 'like_count': 213, 'quote_count': 2}",https://twitter.com/i/web/status/1520743610928406528,
61,51016460,1520560265363804161,2022-05-01 00:26:32+00:00,"@Javier398554871 @dmgarcia94 Una cosa es tener opiniones distintas, y otra acusar de algo reprobable, como hace usted","{'retweet_count': 0, 'reply_count': 1, 'like_count': 0, 'quote_count': 0}",https://twitter.com/i/web/status/1520560265363804161,
62,51016460,1520547954880352257,2022-04-30 23:37:37+00:00,"@LISSIDINI1 Esta entrada de Wikipedia es equilibrada e ilustrativa  
https://t.co/5D5Wu3V6tB","{'retweet_count': 0, 'reply_count': 2, 'like_count': 0, 'quote_count': 0}",https://twitter.com/i/web/status/1520547954880352257,
63,51016460,1520547129067859968,2022-04-30 23:34:20+00:00,"@LISSIDINI1 El di치logo lo refer칤 en un tuit anterior, tal como lo narr칩 uno de los compa침eros de oficina del padre del ni침o","{'retweet_count': 0, 'reply_count': 1, 'like_count': 4, 'quote_count': 0}",https://twitter.com/i/web/status/1520547129067859968,
64,51016460,1520538680095645696,2022-04-30 23:00:46+00:00,"@leandroquerido Qu칠 cara va a salir esa invitaci칩n!!!
游뱎游뱎游뱎","{'retweet_count': 0, 'reply_count': 0, 'like_count': 1, 'quote_count': 0}",https://twitter.com/i/web/status/1520538680095645696,
65,51016460,1520538437211856898,2022-04-30 22:59:48+00:00,"@jmartinezjorge A semanas de un Consejo de Salarios de cuidacoches, con tarifas obligatorias diurnas y nocturnas","{'retweet_count': 1, 'reply_count': 0, 'like_count': 5, 'quote_count': 0}",https://twitter.com/i/web/status/1520538437211856898,
66,51016460,1520538011473256448,2022-04-30 22:58:06+00:00,@leandroquerido Pase el dato. En dos semanas estamos ah칤,"{'retweet_count': 0, 'reply_count': 1, 'like_count': 0, 'quote_count': 0}",https://twitter.com/i/web/status/1520538011473256448,
67,51016460,1520525025383755785,2022-04-30 22:06:30+00:00,@Alfredo_Bruno Dicen que ya cruza la calle sola,"{'retweet_count': 1, 'reply_count': 1, 'like_count': 4, 'quote_count': 0}",https://twitter.com/i/web/status/1520525025383755785,
68,51016460,1520524889333063681,2022-04-30 22:05:58+00:00,@MVanRompaey @nonnina2018 El intercambio al que hice referencia me fue referido por un familiar m칤o en un encuentro de anoche,"{'retweet_count': 1, 'reply_count': 0, 'like_count': 2, 'quote_count': 0}",https://twitter.com/i/web/status/1520524889333063681,
69,51016460,1520524546918567937,2022-04-30 22:04:36+00:00,"@tinchonegriazul 쮺칩mo va a ""formar"" a alguien que expresa una opci칩n diferente a la que sugiere la docente?
Lamento que no pueda asumir hasta qu칠 punto puede llegar el extrav칤o al que lo lleva su creencia dogm치tica y fan치tica, contraria a la raz칩n y el libre albedr칤o","{'retweet_count': 0, 'reply_count': 1, 'like_count': 1, 'quote_count': 0}",https://twitter.com/i/web/status/1520524546918567937,
70,51016460,1520514171078516736,2022-04-30 21:23:22+00:00,"@Piink_pantther Pero la raz칩n es lo opuesto al dogma, que en este caso es creer, sin ninguna prueba, que las personas somos robots sin capacidad de decidir.","{'retweet_count': 0, 'reply_count': 0, 'like_count': 1, 'quote_count': 0}",https://twitter.com/i/web/status/1520514171078516736,
71,51016460,1520513646811443200,2022-04-30 21:21:17+00:00,La m치quina que mata al inventor. https://t.co/IfGMi7an1G,"{'retweet_count': 16, 'reply_count': 4, 'like_count': 78, 'quote_count': 1}",https://twitter.com/i/web/status/1520513646811443200,
