,author_id,tweet_id,time,text,metrics,tweet_url,images
0,51016460,1533789768613511173,2022-06-06 12:35:51+00:00,"La empresa privada actuando de ""cobrador"" honorario del sindicato es el ejemplo m치s elocuente de la actitud de una parte de la sociedad frente al poder corporativo.","{'retweet_count': 4, 'reply_count': 2, 'like_count': 8, 'quote_count': 0}",,
1,51016460,1533788367674036225,2022-06-06 12:30:17+00:00,"Idea para #ElTuitazo3.
Pasa a estudio.","{'retweet_count': 0, 'reply_count': 2, 'like_count': 1, 'quote_count': 0}",,
2,51016460,1533774723460521988,2022-06-06 11:36:04+00:00,"Estad칣sticas #ElTuitazo2:
Hoy se completa la primera semana de reservas de tickets. La jornada se inicia con 37 tickets ya reservados.
En la primera edici칩n se hab칣an colocado 28, pero la venta dio comienzo en agosto.
쮸 cu치ntos tickets llegaremos hoy?
Colectivo 117.745 Abitab","{'retweet_count': 1, 'reply_count': 1, 'like_count': 4, 'quote_count': 0}",,
3,51016460,1533761437667102727,2022-06-06 10:43:17+00:00,"Naaaa.... no lo puedo creer!
Miren si van a ser tan perversos de obligar a la gente a ir a las marchas peronistas con la amenaza de quitarle los planes sociales...
Debe ser una mentira ""de la derecha""...游뱕","{'retweet_count': 9, 'reply_count': 4, 'like_count': 33, 'quote_count': 1}",,
4,51016460,1533753933256175650,2022-06-06 10:13:28+00:00,"Igual que la falta de garrafas. 
La culpa no es de los huelguistas, sino del consumidor que no compr칩 4 garrafas m치s por las dudas.
Putin piensa lo mismo sobre la escasez mundial que provoc칩 su invasi칩n a Ucrania.","{'retweet_count': 5, 'reply_count': 3, 'like_count': 11, 'quote_count': 0}",,
5,51016460,1533643713850793984,2022-06-06 02:55:29+00:00,"Esta se llama ""poder y gloria"".","{'retweet_count': 0, 'reply_count': 1, 'like_count': 0, 'quote_count': 0}",,
6,51016460,1533642168719622144,2022-06-06 02:49:21+00:00,Est치 disponible en Netflix,"{'retweet_count': 0, 'reply_count': 1, 'like_count': 0, 'quote_count': 0}",,
7,51016460,1533641985134940161,2022-06-06 02:48:37+00:00,"Flotilla de Ovnis descendi칩 sobre territorio uruguayo y se apoder칩 de miles de garrafas de supergas, que los huelguistas hab칤an reservado para atender la demanda mientras paralizaban sus tareas.","{'retweet_count': 39, 'reply_count': 9, 'like_count': 155, 'quote_count': 2}",,{'media_keys': ['3_1533641982186336257']}
8,51016460,1533628660086865920,2022-06-06 01:55:40+00:00,Sigue diciendo tonter칤as sin haber visto nadw,"{'retweet_count': 0, 'reply_count': 1, 'like_count': 1, 'quote_count': 0}",,
9,51016460,1533609899229331457,2022-06-06 00:41:07+00:00,si viera la serie se dar칣oa cuenta del tama침o de la estupidez que acaba de escribir,"{'retweet_count': 0, 'reply_count': 1, 'like_count': 2, 'quote_count': 0}",,
10,51016460,1533609086339760133,2022-06-06 00:37:53+00:00,"Se hace pol칣tica para ganar, no para ayudar a ganar al adversario.
(Libro de los Proverbios, 28.4)","{'retweet_count': 1, 'reply_count': 0, 'like_count': 5, 'quote_count': 0}",,
11,51016460,1533605570300846081,2022-06-06 00:23:55+00:00,Herencia de sangre! Felicitaciones!,"{'retweet_count': 0, 'reply_count': 0, 'like_count': 1, 'quote_count': 0}",,
12,51016460,1533605359293956096,2022-06-06 00:23:05+00:00,"Qu칠 alegr칤a, y en la mejor compa침칤a!","{'retweet_count': 0, 'reply_count': 1, 'like_count': 3, 'quote_count': 0}",,
13,51016460,1533605249377787905,2022-06-06 00:22:39+00:00,"Para interesados en periodismo y pol칤tica, la nueva temporada de Borgen lo tiene todo. Juegos de poder, intrigas, estrategia, medio ambiente, feminismo y redes sociales. Los grandes temas del siglo XXI. Grandes actuaciones y un gui칩n vivaz e inteligente.
No se la pierdan.","{'retweet_count': 1, 'reply_count': 4, 'like_count': 13, 'quote_count': 0}",,{'media_keys': ['3_1533605246420779008']}
14,51016460,1533583443610722304,2022-06-05 22:56:00+00:00,"Siempre tratando de salvar la cara, usted. Todos sabemos que es al rev칠s: es Ud el que est치 de acuerdo con ella","{'retweet_count': 0, 'reply_count': 0, 'like_count': 0, 'quote_count': 0}",,
15,51016460,1533579436653744129,2022-06-05 22:40:04+00:00,Ya lo consult칩 con su se침ora?,"{'retweet_count': 0, 'reply_count': 1, 'like_count': 3, 'quote_count': 0}",,
16,51016460,1533577125743063040,2022-06-05 22:30:53+00:00,Nunca es 칰til ignorar la realidad. Menos en pol칤tica,"{'retweet_count': 0, 'reply_count': 2, 'like_count': 4, 'quote_count': 0}",,
17,51016460,1533575472239370240,2022-06-05 22:24:19+00:00,Ustedes que saben todo: hasta cuando los pol칤ticos van a seguir fingiendo que el Frente Amplio y el pitcnt son cosas distintas?,"{'retweet_count': 75, 'reply_count': 49, 'like_count': 417, 'quote_count': 7}",,
18,51016460,1533574467284348931,2022-06-05 22:20:20+00:00,"Es el mismo chip.
No hay posibilidad de cambiarlo. Es el mismo al que va a escuchar en los actos del 1o de mayo.
Nada nuevo.","{'retweet_count': 3, 'reply_count': 0, 'like_count': 17, 'quote_count': 0}",,
19,51016460,1533573660480503808,2022-06-05 22:17:07+00:00,"En qu칠 art칤culo de la Constituci칩n est치 que God칤n no se puede jubilar?
Creo que ya es percha en un cuadro brasilero del mont칩n...","{'retweet_count': 1, 'reply_count': 2, 'like_count': 3, 'quote_count': 0}",,
20,51016460,1533541812765446147,2022-06-05 20:10:34+00:00,"Felicitaciones a los ""negros"" que andan por aqu칤 y me vienen a la memoria      y a todos los hinchas de ese club hist칩rico del f칰tbol uruguayo.","{'retweet_count': 1, 'reply_count': 5, 'like_count': 21, 'quote_count': 0}",,{'media_keys': ['3_1533541808415850496']}
21,51016460,1533539439816867841,2022-06-05 20:01:08+00:00,Es una transmisi칩n propia,"{'retweet_count': 0, 'reply_count': 1, 'like_count': 0, 'quote_count': 0}",,
22,51016460,1533538606178082817,2022-06-05 19:57:50+00:00,No le haga caso don Fito. Est치 revendiendo tickets para #ElTuitazo2.  Se est치 forrando,"{'retweet_count': 0, 'reply_count': 1, 'like_count': 2, 'quote_count': 0}",,
23,51016460,1533537971529560064,2022-06-05 19:55:18+00:00,Y algunos avisos en la tanda,"{'retweet_count': 0, 'reply_count': 1, 'like_count': 0, 'quote_count': 0}",,
24,51016460,1533536946999463937,2022-06-05 19:51:14+00:00,Gratamente sorprendido por la televisaci칩n del f칰tbol uruguayo en  Buenos relatos comentarios atinados y oportunos y buen apoyo desde la propias cancha.,"{'retweet_count': 0, 'reply_count': 3, 'like_count': 6, 'quote_count': 0}",,{'media_keys': ['3_1533536943786565632']}
25,51016460,1533482723066667010,2022-06-05 16:15:46+00:00,M치s tiroteos y m치s muertos en EEUU,"{'retweet_count': 1, 'reply_count': 6, 'like_count': 6, 'quote_count': 0}",,
26,51016460,1533476600574054402,2022-06-05 15:51:26+00:00,"El uno.
Catorce veces.","{'retweet_count': 2, 'reply_count': 4, 'like_count': 42, 'quote_count': 0}",,{'media_keys': ['3_1533476598107734016']}
27,51016460,1533457939721224192,2022-06-05 14:37:17+00:00,Plata tirada.,"{'retweet_count': 0, 'reply_count': 1, 'like_count': 1, 'quote_count': 0}",,
28,51016460,1533455105659478017,2022-06-05 14:26:02+00:00,"La ""boleta 칰nica"" en el estado de Durango, M칠xico. Se entrega al votante una papeleta con todas las opciones, y el votante marca en ella su preferencia. Ahorro de millones de listas con destino a la papelera.","{'retweet_count': 4, 'reply_count': 4, 'like_count': 16, 'quote_count': 0}",,
29,51016460,1533441683492331521,2022-06-05 13:32:41+00:00,"Reservar antes tiene premio. Estos 10 tuiteros recibir치n el 5N alfajor ""personalizado"" de 
Orden listado Abitab:","{'retweet_count': 2, 'reply_count': 5, 'like_count': 16, 'quote_count': 0}",,
30,51016460,1533435501809569792,2022-06-05 13:08:08+00:00,Putin ataca con misiles la capital de Ucrania.,"{'retweet_count': 6, 'reply_count': 3, 'like_count': 12, 'quote_count': 0}",,
31,51016460,1533433985581334528,2022-06-05 13:02:06+00:00,"Una tragedia similar a la del puerto de Beirut, de agosto del 2020, que provoc칩 m치s de 200 muertos y una enorme destrucci칩n.","{'retweet_count': 0, 'reply_count': 2, 'like_count': 4, 'quote_count': 0}",,
32,51016460,1533432224649027585,2022-06-05 12:55:06+00:00,M치s o menos como cuando tu abuela cumple 96. Pero imaginate que tiene 60 millones de nietos.,"{'retweet_count': 1, 'reply_count': 2, 'like_count': 25, 'quote_count': 0}",,
33,51016460,1533428313129099265,2022-06-05 12:39:34+00:00,DM,"{'retweet_count': 0, 'reply_count': 0, 'like_count': 1, 'quote_count': 0}",,
34,51016460,1533424388695023622,2022-06-05 12:23:58+00:00,"Suena poco realista, en el marco de una econom칤a interrelacionada, en la que todos los sectores dependen del correcto funcionamiento de otros.","{'retweet_count': 0, 'reply_count': 2, 'like_count': 0, 'quote_count': 0}",,
35,51016460,1533420805698224128,2022-06-05 12:09:44+00:00,Saben lo peor de todo? Es que creen que ese es el camino correcto.,"{'retweet_count': 13, 'reply_count': 9, 'like_count': 93, 'quote_count': 1}",,
36,51016460,1533419155986055168,2022-06-05 12:03:10+00:00,"Yo no entiendo mucho de golf, por eso no opino. Pero me parece que le ten칤a que pegar para el otro lado, no  ?","{'retweet_count': 0, 'reply_count': 6, 'like_count': 10, 'quote_count': 0}",,
37,51016460,1533417570229002241,2022-06-05 11:56:52+00:00,Cu치l es el fundamento legal para impedirlo?,"{'retweet_count': 0, 'reply_count': 1, 'like_count': 0, 'quote_count': 0}",,
38,51016460,1533413322078429189,2022-06-05 11:40:00+00:00,游뱎游뱎游뱎游뱎,"{'retweet_count': 0, 'reply_count': 2, 'like_count': 3, 'quote_count': 0}",,
39,51016460,1533413055719260160,2022-06-05 11:38:56+00:00,"De Brasil s칩lo ""sabemos"" que Lula va primero en las encuestas","{'retweet_count': 0, 'reply_count': 0, 'like_count': 1, 'quote_count': 0}",,
40,51016460,1533289463115284483,2022-06-05 03:27:49+00:00,...y terminaron entregados.,"{'retweet_count': 0, 'reply_count': 0, 'like_count': 1, 'quote_count': 0}",,
41,51016460,1533277603578142722,2022-06-05 02:40:42+00:00,Nacimiento de los cables. El comienzo de todo.,"{'retweet_count': 0, 'reply_count': 1, 'like_count': 0, 'quote_count': 0}",,
42,51016460,1533267348077019136,2022-06-05 01:59:57+00:00,"Lo prometieron para ""pocas semanas"" hace un a침o","{'retweet_count': 2, 'reply_count': 1, 'like_count': 3, 'quote_count': 0}",,
43,51016460,1533263144046452736,2022-06-05 01:43:14+00:00,"Doce a침os dur칩 el juicio 
La justicia, cuando tarda, es justicia?","{'retweet_count': 19, 'reply_count': 11, 'like_count': 58, 'quote_count': 1}",,
44,51016460,1533252317184671749,2022-06-05 01:00:13+00:00,Es lo que piensan,"{'retweet_count': 0, 'reply_count': 0, 'like_count': 1, 'quote_count': 0}",,
45,51016460,1533230884240998400,2022-06-04 23:35:03+00:00,"Es un ""miedo racional"", producto de un an치lisis que concluye que se pierde m치s haciendo algo que no haciendo nada","{'retweet_count': 0, 'reply_count': 2, 'like_count': 5, 'quote_count': 0}",,
46,51016460,1533210496287006721,2022-06-04 22:14:02+00:00,Y Ruglio?,"{'retweet_count': 7, 'reply_count': 10, 'like_count': 32, 'quote_count': 2}",,
47,51016460,1533209875903303681,2022-06-04 22:11:34+00:00,Me acuerdo perfecto,"{'retweet_count': 0, 'reply_count': 1, 'like_count': 0, 'quote_count': 0}",,
48,51016460,1533202936666505222,2022-06-04 21:44:00+00:00,"""La pol칤tica es un acto de equilibrio entre los que quieren entrar y los que no quieren salir""
(Jacques Bossuet, 1627 Dijon -1704 Par칤s, cl칠rigo e intelectual franc칠s)","{'retweet_count': 2, 'reply_count': 1, 'like_count': 30, 'quote_count': 0}",,
49,51016460,1533187003935768578,2022-06-04 20:40:41+00:00,九껊잺游뱉,"{'retweet_count': 0, 'reply_count': 0, 'like_count': 2, 'quote_count': 0}",,
50,51016460,1533186480146894848,2022-06-04 20:38:36+00:00,"Yo le paso la lista a Julia, pero lo mejor ser칤a, si Julia est치 de acuerdo, entregarlos con envoltorio personalizado, el 5N en la Parva Domus.","{'retweet_count': 0, 'reply_count': 2, 'like_count': 4, 'quote_count': 0}",,
51,51016460,1533180839105810435,2022-06-04 20:16:11+00:00,"Saben c칩mo se arregla esto de que entran a la cancha a la hora que quieren?
Declarando la p칠rdida de los puntos en disputa del club que no cumple el horario.","{'retweet_count': 2, 'reply_count': 24, 'like_count': 55, 'quote_count': 2}",,{'media_keys': ['3_1533180835993731079']}
52,51016460,1533179093616930818,2022-06-04 20:09:15+00:00,Se piede decretar por razones de salud o seguridad.,"{'retweet_count': 0, 'reply_count': 0, 'like_count': 0, 'quote_count': 0}",,
53,51016460,1533174885052256256,2022-06-04 19:52:32+00:00,Miente en esto?,"{'retweet_count': 0, 'reply_count': 2, 'like_count': 2, 'quote_count': 0}",,
54,51016460,1533171073721720835,2022-06-04 19:37:23+00:00,Actuar contra el propio inter칠s es incomprensible,"{'retweet_count': 0, 'reply_count': 0, 'like_count': 2, 'quote_count': 0}",,
55,51016460,1533167409187672065,2022-06-04 19:22:49+00:00,J'ai compris...游뗵,"{'retweet_count': 0, 'reply_count': 1, 'like_count': 1, 'quote_count': 0}",,
56,51016460,1533163042946572289,2022-06-04 19:05:28+00:00,游땞,"{'retweet_count': 0, 'reply_count': 0, 'like_count': 2, 'quote_count': 0}",,
57,51016460,1533162954165829632,2022-06-04 19:05:07+00:00,"Si usted pudiera, yo me anotar칤a con Ud...","{'retweet_count': 0, 'reply_count': 1, 'like_count': 1, 'quote_count': 0}",,
58,51016460,1533162746547785735,2022-06-04 19:04:18+00:00,Cada uno sabe donde le apreta el zapato.,"{'retweet_count': 0, 'reply_count': 0, 'like_count': 1, 'quote_count': 0}",,
59,51016460,1533162557250453505,2022-06-04 19:03:33+00:00,"No soy quien para dar consejos a nadie. Y menos al Pte  . Expreso un punto de vista, simplemente.","{'retweet_count': 0, 'reply_count': 0, 'like_count': 1, 'quote_count': 0}",,
60,51016460,1533162101925191681,2022-06-04 19:01:44+00:00,"Buen punto. Revelador, por cierto, del ""mar de fondo"" en el gremio.","{'retweet_count': 2, 'reply_count': 0, 'like_count': 1, 'quote_count': 0}",,
61,51016460,1533161534687428610,2022-06-04 18:59:29+00:00,"Pro Mosc칰. 
Pro La Habana. 
Pro Caracas.","{'retweet_count': 5, 'reply_count': 4, 'like_count': 23, 'quote_count': 1}",,
62,51016460,1533160745009041416,2022-06-04 18:56:21+00:00,"No son de derecha ni de izquierda. Son pro rusos. Gobierne quien gobierne en Mosc칰, los comunistas uruguayos son pro rusos.
La casa matriz nunca cambi칩.","{'retweet_count': 7, 'reply_count': 4, 'like_count': 29, 'quote_count': 0}",,
63,51016460,1533159362948104192,2022-06-04 18:50:51+00:00,"Tiritar de fr칤o para defender a un patotero. 
S칤ndrome de Estocolmo.","{'retweet_count': 1, 'reply_count': 2, 'like_count': 9, 'quote_count': 0}",,
64,51016460,1533140457303199744,2022-06-04 17:35:44+00:00,"Sin violencia, por favor. 游똂","{'retweet_count': 0, 'reply_count': 1, 'like_count': 2, 'quote_count': 0}",,
65,51016460,1533138582587703296,2022-06-04 17:28:17+00:00,"Un gobierno  -cualquier gobierno- debe buscar el equilibrio de los derechos en la sociedad. El derecho a trabajar y el derecho a no hacerlo, por ejemplo, con todas sus derivaciones","{'retweet_count': 1, 'reply_count': 1, 'like_count': 8, 'quote_count': 0}",,
66,51016460,1533138140394835970,2022-06-04 17:26:31+00:00,"Como dijo un juez argentino, detr치s de una necesidad no hay un derecho. Es simple y claro. 
Simplemente hay que tener la valent칤a de decir la verdad.","{'retweet_count': 0, 'reply_count': 1, 'like_count': 3, 'quote_count': 0}",,
67,51016460,1533136607691395072,2022-06-04 17:20:26+00:00,La carnada es muy mala,"{'retweet_count': 0, 'reply_count': 0, 'like_count': 0, 'quote_count': 0}",,
68,51016460,1533136304594112512,2022-06-04 17:19:13+00:00,"Cuando no se tiene confianza en las propias fuerzas, ni convicci칩n en las propias ideas, se entra en el marasmo en el que est치 inmerso el Uruguay","{'retweet_count': 1, 'reply_count': 2, 'like_count': 2, 'quote_count': 0}",,
69,51016460,1533132878258880518,2022-06-04 17:05:37+00:00,Deja algo para los amigos cuando llegues...,"{'retweet_count': 0, 'reply_count': 0, 'like_count': 0, 'quote_count': 0}",,
70,51016460,1533128957297664000,2022-06-04 16:50:02+00:00,En defensa de las otras?,"{'retweet_count': 0, 'reply_count': 1, 'like_count': 1, 'quote_count': 0}",,
71,51016460,1533128476345212930,2022-06-04 16:48:07+00:00,Interesante hip칩tesis: amar al que te ha secuestrado la voluntad.,"{'retweet_count': 0, 'reply_count': 1, 'like_count': 4, 'quote_count': 0}",,
72,51016460,1533128242722480129,2022-06-04 16:47:11+00:00,"Y como entienden que es ""justo"" defender a un patotero, entonces aceptan mansamente tiritar de fr칤o. 
No me convence la explicaci칩n.","{'retweet_count': 3, 'reply_count': 2, 'like_count': 15, 'quote_count': 0}",,
73,51016460,1533127082527670272,2022-06-04 16:42:35+00:00,"Risa por la estupidez de la -llam칠mosle- ""explicaci칩n"", y asco por la impunidad con la que una 칠lite sindical hace sufrir a los m치s d칠biles de la sociedad.","{'retweet_count': 0, 'reply_count': 0, 'like_count': 8, 'quote_count': 0}",,
74,51016460,1533125675548299266,2022-06-04 16:36:59+00:00,"La culpa de quedarse sin gas por una huelga es....del tipo que se qued칩 sin gas.
Te re칤s, pute치s y vomit치s en un solo movimiento.","{'retweet_count': 1, 'reply_count': 1, 'like_count': 6, 'quote_count': 0}",,
75,51016460,1533124914034708482,2022-06-04 16:33:58+00:00,"Lo hab칤amos pensado al comienzo, pero el aluvi칩n de los primeros d칤as nos llev칩 a ampliar las chances a los primeros 100.","{'retweet_count': 0, 'reply_count': 0, 'like_count': 0, 'quote_count': 0}",,
76,51016460,1533124536446730240,2022-06-04 16:32:28+00:00,Alguna teor칤a en particular?,"{'retweet_count': 0, 'reply_count': 1, 'like_count': 1, 'quote_count': 0}",,
77,51016460,1533124263158349827,2022-06-04 16:31:23+00:00,"Ahh...bueno. 
La desesperaci칩n a veces lleva a un conflicto con la ideolog칤a.","{'retweet_count': 0, 'reply_count': 2, 'like_count': 1, 'quote_count': 0}",,
78,51016460,1533123809485762562,2022-06-04 16:29:34+00:00,"Hay algo que tiene que explicar la complicidad de cientos de miles de uruguayos con los sindicalistas que los deja sin supergas en medio de una ola de fr칤o polar, y la timidez de las autoridades en reaccionar para proteger a la poblaci칩n.
Qu칠 ser치?
Los leo.","{'retweet_count': 103, 'reply_count': 113, 'like_count': 453, 'quote_count': 5}",,
79,51016460,1533122887242194944,2022-06-04 16:25:55+00:00,Como dec칤a Borges: incorregibles.,"{'retweet_count': 0, 'reply_count': 0, 'like_count': 1, 'quote_count': 0}",,
80,51016460,1533122671067668481,2022-06-04 16:25:03+00:00,Pero ella est치 en pie a las 5 de la ma침a침a. Invierno y verano.,"{'retweet_count': 0, 'reply_count': 1, 'like_count': 0, 'quote_count': 0}",,
81,51016460,1533122415655518208,2022-06-04 16:24:02+00:00,"El gesto tranquilo y confiado de quien ya tiene su ticket para #ElTuitazo2, y participa en el sorteo de la caja de alfajores de","{'retweet_count': 0, 'reply_count': 1, 'like_count': 5, 'quote_count': 0}",,
82,51016460,1533121955997569025,2022-06-04 16:22:12+00:00,"Comenzamos muy bien este s치bado!
 reserv칩 su ticket hoy, y participa por el sorteo de una caja de alfajores  junto a los otros 99 tuiteros que completen la primera tanda de 100.
Quedan a칰n 63 chances. 
#ElTuitazo2 
5N
Parva Domus","{'retweet_count': 1, 'reply_count': 0, 'like_count': 4, 'quote_count': 0}",,
83,51016460,1533120975759638528,2022-06-04 16:18:19+00:00,Como mi madre,"{'retweet_count': 0, 'reply_count': 1, 'like_count': 0, 'quote_count': 0}",,
84,51016460,1533120587979169793,2022-06-04 16:16:46+00:00,A ver  : c칩mo es esto?,"{'retweet_count': 0, 'reply_count': 0, 'like_count': 1, 'quote_count': 0}",,
85,51016460,1533111720956284929,2022-06-04 15:41:32+00:00,Es un ajuste de cuentas dentro del propio gremio.,"{'retweet_count': 1, 'reply_count': 1, 'like_count': 8, 'quote_count': 0}",,
86,51016460,1533109126590517249,2022-06-04 15:31:14+00:00,Es una decisi칩n del gremio.,"{'retweet_count': 0, 'reply_count': 1, 'like_count': 2, 'quote_count': 0}",,
87,51016460,1533107116868784129,2022-06-04 15:23:15+00:00,"Negativo, se침or.
""췅Hmildes"", no. Simplemente realistas.","{'retweet_count': 0, 'reply_count': 1, 'like_count': 3, 'quote_count': 0}",,
88,51016460,1533103167461793793,2022-06-04 15:07:33+00:00,Y Balcedo dice cosas peores,"{'retweet_count': 0, 'reply_count': 0, 'like_count': 5, 'quote_count': 0}",,
89,51016460,1533100800477646848,2022-06-04 14:58:09+00:00,"Manga de degenerados!
Estamos evaluando prohibirles la entrada a #ElTuitazo2...
游뱂","{'retweet_count': 0, 'reply_count': 0, 'like_count': 2, 'quote_count': 0}",,
90,51016460,1533090688186843136,2022-06-04 14:17:58+00:00,"Balcedo tambi칠n ser치 un ""chimango""?","{'retweet_count': 16, 'reply_count': 13, 'like_count': 48, 'quote_count': 1}",,
91,51016460,1533089023039782912,2022-06-04 14:11:21+00:00,"Consejo para empresarios del supergas, y para cualquiera que quiera tener una relaci칩n amistosa con su sindicato: primero c칩mprense un canal de televisi칩n. 
Qu칠 le parece este plan de negocios, amigo  ?","{'retweet_count': 0, 'reply_count': 1, 'like_count': 6, 'quote_count': 0}",,
92,51016460,1533086399272038400,2022-06-04 14:00:55+00:00,"""Ese Pep칤n Rodr칤guez Sim칩n, que arm칩 toda esa trampa en Argentina con el macrismo, es el que defiende ahora Jorge D칤az, 춰oh casualidad! Mir치 vos..""
Balcedo a la ofensiva.","{'retweet_count': 12, 'reply_count': 3, 'like_count': 17, 'quote_count': 1}",,
93,51016460,1533084159572320257,2022-06-04 13:52:01+00:00,"Terremoto en el negocio televisivo de los partidos de la selecci칩n uruguaya. 
Tal vez esto explique las posibles ""interferencias externas"" en la transmisi칩n de Uruguay-M칠xico por la se침al de Auf Tv.","{'retweet_count': 2, 'reply_count': 1, 'like_count': 2, 'quote_count': 0}",,
94,51016460,1533075564629831685,2022-06-04 13:17:52+00:00,Estamos en el alargue...despu칠s vienen los penales.,"{'retweet_count': 0, 'reply_count': 1, 'like_count': 1, 'quote_count': 0}",,
95,51016460,1533075374795636737,2022-06-04 13:17:07+00:00,"Un medio de vida, no. Pero si algo que estimula y empuja hacia adelante. La recompensa es la alegr칤a de la gente que se re칰ne para compartir un espacio de diversi칩n y amistad.
Eso no tiene precio.","{'retweet_count': 0, 'reply_count': 1, 'like_count': 6, 'quote_count': 0}",,
96,51016460,1533069908212338690,2022-06-04 12:55:23+00:00,Sabia decisi칩n.,"{'retweet_count': 0, 'reply_count': 1, 'like_count': 4, 'quote_count': 0}",,
97,51016460,1533069742923300865,2022-06-04 12:54:44+00:00,"Mucha suerte a todos los ""madrugadores""...","{'retweet_count': 0, 'reply_count': 0, 'like_count': 2, 'quote_count': 0}",,
98,51016460,1533069342992220160,2022-06-04 12:53:09+00:00,"El 5 de Noviembre ""Mam치 en concierto"".
Que vaya preparando el repertorio. Capaz que 
se anima a cantar uno de esos tangos.

#ElTuitazo2","{'retweet_count': 0, 'reply_count': 0, 'like_count': 11, 'quote_count': 0}",,
99,51016460,1533068266758864897,2022-06-04 12:48:52+00:00,"Saliendo de Par칤s, es aconsejable subir al avi칩n con un par de baguettes en la mochila.","{'retweet_count': 0, 'reply_count': 2, 'like_count': 7, 'quote_count': 0}",,
