,author_id,tweet_id,time,text,metrics,tweet_url,images
0,103296066,1517500145792917506,2022-04-22 13:46:43+00:00,José Saramago: una bofetada de zurda a la era de los emprendedores. La #mirada de Gerardo Carrasco Laíno en el #SuplementoCultura,"{'retweet_count': 0, 'reply_count': 0, 'like_count': 0, 'quote_count': 0}",,
1,103296066,1517496466088075267,2022-04-22 13:32:05+00:00,La primera Copa Uruguay se jugará desde junio con clubes de AUF y OFI,"{'retweet_count': 0, 'reply_count': 0, 'like_count': 2, 'quote_count': 0}",,
2,103296066,1517492709547778049,2022-04-22 13:17:10+00:00,Darío Pérez aceptó la propuesta de la Intendencia de Maldonado para coordinar un plan piloto de tratamiento y prevención de adicciones #LaDiariaMaldonado,"{'retweet_count': 0, 'reply_count': 1, 'like_count': 1, 'quote_count': 0}",,
3,103296066,1517489308231512064,2022-04-22 13:03:39+00:00,Funcionarios de ASSE en Maldonado reclaman ante cierre parcial del CTI polivalente #LaDiariaMaldonado,"{'retweet_count': 2, 'reply_count': 0, 'like_count': 4, 'quote_count': 0}",,
4,103296066,1517486224830783489,2022-04-22 12:51:24+00:00,"Reflejo de lo que somos: la muestra ""El archivo liberado"" en la sede del CdF #SuplementoCultura","{'retweet_count': 0, 'reply_count': 0, 'like_count': 0, 'quote_count': 0}",,
5,103296066,1517484088541777920,2022-04-22 12:42:54+00:00,Peri Rossi al recibir su Premio Cervantes: “En una sociedad patriarcal ser mujer e independiente era raro y sospechoso”,"{'retweet_count': 5, 'reply_count': 1, 'like_count': 18, 'quote_count': 0}",,
6,103296066,1517482850781650945,2022-04-22 12:37:59+00:00,Primer Encuentro de Familias Diversas en Colonia #LaDiariaColonia,"{'retweet_count': 0, 'reply_count': 0, 'like_count': 1, 'quote_count': 0}",,
7,103296066,1517480893283196934,2022-04-22 12:30:13+00:00,Compartimos la portada de nuestro #SuplementoCultura,"{'retweet_count': 0, 'reply_count': 0, 'like_count': 0, 'quote_count': 0}",,{'media_keys': ['3_1517480891559337985']}
8,103296066,1517477746938679296,2022-04-22 12:17:42+00:00,Un hombre fue asesinado y su torso apareció mutilado flotando en el agua de la Rambla de Barrio Sur,"{'retweet_count': 0, 'reply_count': 1, 'like_count': 1, 'quote_count': 2}",,
9,103296066,1517474135965847553,2022-04-22 12:03:21+00:00,¿Existen las brujas hermosas? La #postura de Julián Mazzoni,"{'retweet_count': 2, 'reply_count': 0, 'like_count': 6, 'quote_count': 0}",,{'media_keys': ['3_1517474134082600960']}
10,103296066,1517470359842439170,2022-04-22 11:48:21+00:00,"Ante el TCA, Katoen Natie cuestionó legitimidad de Montecon; director y abogado de ANP declararon en Fiscalía","{'retweet_count': 1, 'reply_count': 0, 'like_count': 1, 'quote_count': 0}",,
11,103296066,1517466854800908288,2022-04-22 11:34:26+00:00,Ministerio de Defensa sancionará a integrantes de la Armada que critiquen al gobierno en redes sociales #LaDiariaJusticia,"{'retweet_count': 1, 'reply_count': 1, 'like_count': 0, 'quote_count': 3}",,
12,103296066,1517463324425916418,2022-04-22 11:20:24+00:00,El mal momento de Netflix: cae el número de suscriptores y debaten las causas,"{'retweet_count': 0, 'reply_count': 1, 'like_count': 0, 'quote_count': 0}",,
13,103296066,1517459572050571264,2022-04-22 11:05:29+00:00,"Con oposición de representantes docentes, Codicen aprobó documento inicial para nuevo Marco Curricular Nacional #LaDiariaEducación","{'retweet_count': 0, 'reply_count': 0, 'like_count': 1, 'quote_count': 1}",,
14,103296066,1517456415727697920,2022-04-22 10:52:57+00:00,"El análisis de Marcelo Pereira de las principales noticias del día: Raffo parece creer que cuanto peor, mejor #ApuntesDelDía","{'retweet_count': 5, 'reply_count': 3, 'like_count': 11, 'quote_count': 0}",,
15,103296066,1517453396248301568,2022-04-22 10:40:57+00:00,"No se aprobó el préstamo del BID: “No nos quieren dejar trabajar”, dijo Cosse y lo calificó de “política menor”","{'retweet_count': 7, 'reply_count': 9, 'like_count': 34, 'quote_count': 2}",,
16,103296066,1517450867951210496,2022-04-22 10:30:54+00:00,Nuestra portada de hoy,"{'retweet_count': 27, 'reply_count': 27, 'like_count': 147, 'quote_count': 4}",,{'media_keys': ['3_1517450865841426434']}
17,103296066,1517422352572768258,2022-04-22 08:37:35+00:00,Universidad Tres de Febrero de Argentina llama a una beca de posgrado para residentes en Uruguay #LaDiariaEducación,"{'retweet_count': 1, 'reply_count': 0, 'like_count': 2, 'quote_count': 0}",,
18,103296066,1517384349225824256,2022-04-22 06:06:35+00:00,El final de una trilogía y un nuevo comienzo para La Foca.,"{'retweet_count': 1, 'reply_count': 0, 'like_count': 2, 'quote_count': 0}",,
19,103296066,1517373469352157184,2022-04-22 05:23:21+00:00,Futuras diseñadoras investigan con descartes textiles y cáscara de huevo para fabricar objetos sustentables.,"{'retweet_count': 0, 'reply_count': 0, 'like_count': 2, 'quote_count': 0}",,
20,103296066,1517369461489156103,2022-04-22 05:07:25+00:00,Un libro pasa revista a la evolución del programa Plazas de Deportes en Montevideo desde 1900.,"{'retweet_count': 0, 'reply_count': 0, 'like_count': 1, 'quote_count': 0}",,
21,103296066,1517365428661764096,2022-04-22 04:51:24+00:00,Las diatribas de abril para perpetuar la impunidad; la #postura de Héctor Altamirano.,"{'retweet_count': 1, 'reply_count': 0, 'like_count': 2, 'quote_count': 0}",,{'media_keys': ['3_1517365426648489984']}
22,103296066,1517358879679651842,2022-04-22 04:25:22+00:00,Vidalín: una muestra del populismo nativo entre Jesús y Discepolín. La #postura de Garabed Arakelian.,"{'retweet_count': 0, 'reply_count': 0, 'like_count': 3, 'quote_count': 0}",,{'media_keys': ['3_1517358877376929792']}
23,103296066,1517351590239535104,2022-04-22 03:56:24+00:00,Ponerse en el lugar de las víctimas; la #postura de Pablo Anzalone,"{'retweet_count': 0, 'reply_count': 0, 'like_count': 0, 'quote_count': 0}",,{'media_keys': ['3_1517351587907309568']}
24,103296066,1517341840797847555,2022-04-22 03:17:40+00:00,Funcionarios de ASSE en Maldonado reclaman ante cierre parcial del CTI polivalente #LaDiariaMaldonado,"{'retweet_count': 4, 'reply_count': 0, 'like_count': 4, 'quote_count': 0}",,
25,103296066,1517337690651430913,2022-04-22 03:01:10+00:00,El análisis de Marcelo Pereira de las principales noticias del día: La historia interminable de los deudores en UR #ApuntesDelDía,"{'retweet_count': 1, 'reply_count': 0, 'like_count': 2, 'quote_count': 0}",,
26,103296066,1517335351601287170,2022-04-22 02:51:53+00:00,"Tres de La Coqueta: poesía de Santiago Pereira, Alicia Preza y Diego de Ávila","{'retweet_count': 0, 'reply_count': 0, 'like_count': 0, 'quote_count': 0}",,
27,103296066,1517333448708472833,2022-04-22 02:44:19+00:00,La alimentación escolar en la mira: ¿despilfarro o recorte? La #postura de Héctor Florit,"{'retweet_count': 1, 'reply_count': 0, 'like_count': 2, 'quote_count': 0}",,{'media_keys': ['3_1517333446615568384']}
28,103296066,1517331000900128771,2022-04-22 02:34:35+00:00,Tres islas del Queguay formarán parte del Sistema Nacional de Áreas Protegidas #LaDiariaAmbiente,"{'retweet_count': 0, 'reply_count': 0, 'like_count': 6, 'quote_count': 0}",,
29,103296066,1517328389761339393,2022-04-22 02:24:13+00:00,Operación Océano ingresa en la última etapa previa al juicio #LaDiariaJusticia,"{'retweet_count': 0, 'reply_count': 0, 'like_count': 0, 'quote_count': 0}",,
30,103296066,1517326026711384064,2022-04-22 02:14:49+00:00,La unidad de la ciencia: el caso de las ciencias sociales #LaDiariaCiencia,"{'retweet_count': 0, 'reply_count': 0, 'like_count': 0, 'quote_count': 0}",,
31,103296066,1517322734996496384,2022-04-22 02:01:45+00:00,Expresidenta de Asfavide ratificó denuncia por “malos tratos” de Santiago González. #LaDiariaJusticia,"{'retweet_count': 5, 'reply_count': 0, 'like_count': 7, 'quote_count': 0}",,
32,103296066,1517321387932893185,2022-04-22 01:56:24+00:00,Abren instancia de negociación entre trabajadores de Búsqueda y Galería y la empresa #LaDiariaTrabajo,"{'retweet_count': 1, 'reply_count': 0, 'like_count': 0, 'quote_count': 0}",,
33,103296066,1517320177377030145,2022-04-22 01:51:35+00:00,"Disidencias corporales en bicicleta, limpieza costera e intercambios sobre migración en la agenda semanal.","{'retweet_count': 0, 'reply_count': 0, 'like_count': 1, 'quote_count': 0}",,
34,103296066,1517318940820660225,2022-04-22 01:46:40+00:00,"Uruguay registra una nueva especie de pez marino, síntoma de un cambio en nuestras aguas. #LaDiariaCiencia","{'retweet_count': 0, 'reply_count': 0, 'like_count': 6, 'quote_count': 1}",,
35,103296066,1517317153690722305,2022-04-22 01:39:34+00:00,El análisis de Marcelo Pereira de las principales noticias del día: Las aguas bajan turbias en el puerto. #ApuntesDelDía,"{'retweet_count': 0, 'reply_count': 0, 'like_count': 1, 'quote_count': 0}",,
36,103296066,1517315447066087425,2022-04-22 01:32:47+00:00,La Federación Latinoamericana de Fiscales rechazó el proyecto de Cabildo Abierto para sancionar penalmente a los fiscales #LaDiariaJusticia,"{'retweet_count': 3, 'reply_count': 2, 'like_count': 16, 'quote_count': 2}",,
37,103296066,1517313614113345536,2022-04-22 01:25:30+00:00,"Aprobación de la gestión de Lacalle Pou baja cinco puntos, según Equipos.","{'retweet_count': 2, 'reply_count': 10, 'like_count': 10, 'quote_count': 1}",,
38,103296066,1517311767042531328,2022-04-22 01:18:10+00:00,"Entrevista con Pablo Peluffo, entrenador, orientador del proyecto La Escalinata y trabajador social de Defensor Sporting.","{'retweet_count': 1, 'reply_count': 0, 'like_count': 0, 'quote_count': 0}",,
39,103296066,1517309625720348674,2022-04-22 01:09:39+00:00,"Lacalle Pou, tras quejas del Pit-Cnt por medidas sobre salarios: “Han tenido una oposición sistemática hacia el gobierno”.","{'retweet_count': 2, 'reply_count': 3, 'like_count': 5, 'quote_count': 2}",,
40,103296066,1517307531407859712,2022-04-22 01:01:20+00:00,Presidente del BPS: “No entiendo por qué se quejan cuando hay un aumento” de las jubilaciones.,"{'retweet_count': 0, 'reply_count': 3, 'like_count': 1, 'quote_count': 1}",,
41,103296066,1517305230681120768,2022-04-22 00:52:11+00:00,El Ministerio de Defensa sancionará a integrantes de la Armada que critiquen al gobierno en redes sociales,"{'retweet_count': 25, 'reply_count': 24, 'like_count': 31, 'quote_count': 37}",,
42,103296066,1517303613403578368,2022-04-22 00:45:46+00:00,"Tras reunión con Mieres, PIT-CNT confirmó que aumentos anunciados son “insuficientes” para cubrir la pérdida salarial","{'retweet_count': 1, 'reply_count': 2, 'like_count': 7, 'quote_count': 0}",,
43,103296066,1517301580449603585,2022-04-22 00:37:41+00:00,Elon Musk busca un aliado para comprar la totalidad de Twitter,"{'retweet_count': 0, 'reply_count': 1, 'like_count': 1, 'quote_count': 1}",,
44,103296066,1517298957612949504,2022-04-22 00:27:16+00:00,"Prohibido dormir: comenzaron los playoffs de la NBA, la etapa más emocionante de la temporada.","{'retweet_count': 0, 'reply_count': 0, 'like_count': 0, 'quote_count': 0}",,
45,103296066,1517296411318132739,2022-04-22 00:17:09+00:00,Leucemia mieloblástica aguda: una enfermedad rara que en Uruguay desarrolla alrededor de 100 casos por año #LaDiariaSalud,"{'retweet_count': 1, 'reply_count': 0, 'like_count': 2, 'quote_count': 0}",,
46,103296066,1517294322760269829,2022-04-22 00:08:51+00:00,Justicia británica emitió la orden para extraditar a Julian Assange a Estados Unidos.,"{'retweet_count': 1, 'reply_count': 0, 'like_count': 1, 'quote_count': 0}",,
47,103296066,1517291153841917955,2022-04-21 23:56:15+00:00,Rusia proclamó la “liberación” de Mariúpol y Putin ordenó no avanzar sobre la fábrica siderúrgica Azovstal,"{'retweet_count': 2, 'reply_count': 0, 'like_count': 2, 'quote_count': 0}",,
48,103296066,1517288504954343424,2022-04-21 23:45:44+00:00,La primera Copa Uruguay se jugará desde junio con clubes de AUF y OFI,"{'retweet_count': 1, 'reply_count': 0, 'like_count': 4, 'quote_count': 0}",,
49,103296066,1517287231202942976,2022-04-21 23:40:40+00:00,Paraguay: polémica por proyecto de ley que pretende aumentar penas por cortes de ruta,"{'retweet_count': 1, 'reply_count': 0, 'like_count': 3, 'quote_count': 0}",,
50,103296066,1517285559374389248,2022-04-21 23:34:01+00:00,Uruguay cayó 1 a 0 con Brasil pero sigue soñando con el Mundial sub 20,"{'retweet_count': 1, 'reply_count': 0, 'like_count': 2, 'quote_count': 0}",,
51,103296066,1517284426702626817,2022-04-21 23:29:31+00:00,Reino Unido: el Parlamento decidió investigar a Boris Johnson por las fiestas en Downing Street durante la pandemia,"{'retweet_count': 3, 'reply_count': 0, 'like_count': 4, 'quote_count': 0}",,
52,103296066,1517283815311523840,2022-04-21 23:27:05+00:00,"Patricia Gularte, una de las primeras jugadoras del fútbol femenino uruguayo.","{'retweet_count': 1, 'reply_count': 0, 'like_count': 2, 'quote_count': 0}",,
53,103296066,1517280625228722177,2022-04-21 23:14:25+00:00,Playoffs de la Liga Uruguaya de Básquetbol: el clásico de otoño.,"{'retweet_count': 0, 'reply_count': 0, 'like_count': 1, 'quote_count': 0}",,
54,103296066,1517277609910018049,2022-04-21 23:02:26+00:00,"""El empleado y el patrón"": Las penas son de nosotros, las maquinitas son ajenas.","{'retweet_count': 2, 'reply_count': 3, 'like_count': 6, 'quote_count': 0}",,
55,103296066,1517274570100809730,2022-04-21 22:50:21+00:00,Suscripciones y reacciones: novedades que se vienen en Whatsapp,"{'retweet_count': 0, 'reply_count': 0, 'like_count': 0, 'quote_count': 0}",,
56,103296066,1517272712686809088,2022-04-21 22:42:58+00:00,Un hombre fue asesinado y su torso apareció mutilado flotando en el agua de la Rambla de Barrio Sur,"{'retweet_count': 0, 'reply_count': 3, 'like_count': 1, 'quote_count': 3}",,
57,103296066,1517271463849508868,2022-04-21 22:38:01+00:00,Se celebrará la primera conferencia sobre tecnología y género con un panel integrado exclusivamente por mujeres,"{'retweet_count': 0, 'reply_count': 0, 'like_count': 1, 'quote_count': 0}",,
58,103296066,1517270316464193536,2022-04-21 22:33:27+00:00,Ministerio de Defensa sancionará a integrantes de la Armada que critiquen al gobierno en redes sociales,"{'retweet_count': 9, 'reply_count': 11, 'like_count': 20, 'quote_count': 20}",,
59,103296066,1517269012866125826,2022-04-21 22:28:16+00:00,Bolsonaro calificó a Lula como “el enemigo de la nación” y dijo que en su bandera “hay una hoz y un martillo”.,"{'retweet_count': 1, 'reply_count': 0, 'like_count': 1, 'quote_count': 1}",,
60,103296066,1517268414607376390,2022-04-21 22:25:54+00:00,Este domingo vuelve la actividad en el fútbol femenino de AUF por el Uruguayo 2021,"{'retweet_count': 4, 'reply_count': 0, 'like_count': 3, 'quote_count': 0}",,
61,103296066,1517266455443738625,2022-04-21 22:18:07+00:00,"La empresa argentina Globant compró Genexus, pero Jodal continuará como CEO.","{'retweet_count': 1, 'reply_count': 0, 'like_count': 3, 'quote_count': 0}",,
62,103296066,1517263149006823424,2022-04-21 22:04:58+00:00,"Salario real: los dos años de caída, con qué pérdida se llegaría a los ajustes de julio y el debate sobre la recuperación.","{'retweet_count': 2, 'reply_count': 0, 'like_count': 3, 'quote_count': 0}",,
63,103296066,1517259907812278274,2022-04-21 21:52:06+00:00,El futuro de Brasil; la #postura de Juca Ferreira.,"{'retweet_count': 2, 'reply_count': 0, 'like_count': 1, 'quote_count': 0}",,{'media_keys': ['3_1517259905803206656']}
64,103296066,1517256987200872449,2022-04-21 21:40:29+00:00,Antel declaró “reservados” los gastos en publicidad a pesar de que Gurméndez había dicho que “la transparencia es un mandato legal”,"{'retweet_count': 20, 'reply_count': 8, 'like_count': 48, 'quote_count': 5}",,
65,103296066,1517253756999585793,2022-04-21 21:27:39+00:00,El Sindicato Policial de Maldonado calificó a Santiago González como un “paracaidista”. #LaDiariaJusticia,"{'retweet_count': 10, 'reply_count': 2, 'like_count': 12, 'quote_count': 2}",,
66,103296066,1517252989194543105,2022-04-21 21:24:36+00:00,Cae préstamo para la IM: edil del Partido de la Gente afirmó en sesión que no votará el proyecto y fue aplaudido por los blancos,"{'retweet_count': 10, 'reply_count': 11, 'like_count': 23, 'quote_count': 8}",,
67,103296066,1517251796959379456,2022-04-21 21:19:52+00:00,Congreso de intendentes: se postergó la votación para unificar las multas de tránsito,"{'retweet_count': 1, 'reply_count': 0, 'like_count': 0, 'quote_count': 0}",,
68,103296066,1517251345203539968,2022-04-21 21:18:04+00:00,Cine uruguayo en el 40° Festival Cinematográfico Internacional del Uruguay.,"{'retweet_count': 2, 'reply_count': 0, 'like_count': 3, 'quote_count': 0}",,
69,103296066,1517248101894995968,2022-04-21 21:05:11+00:00,Trabajadores del Hospital Español se movilizaron en rechazo de las condiciones laborales y el cese de 160 contratos #LaDiariaSalud,"{'retweet_count': 3, 'reply_count': 1, 'like_count': 6, 'quote_count': 0}",,
70,103296066,1517245007102681091,2022-04-21 20:52:53+00:00,Para edil del FA si prospera la nulidad del juicio a alcalde de Florencio Sánchez se generaría “una situación terrible” #LaDiariaColonia,"{'retweet_count': 0, 'reply_count': 0, 'like_count': 0, 'quote_count': 0}",,
71,103296066,1517243196698501120,2022-04-21 20:45:41+00:00,Sindicato policial de Canelones denuncia que “el gobierno sólo apoya al personal superior y sus asesores”. #LaDiariaJusticia,"{'retweet_count': 5, 'reply_count': 0, 'like_count': 9, 'quote_count': 1}",,
72,103296066,1517241167615827968,2022-04-21 20:37:37+00:00,Condenaron a cuatro hombres por trata de personas en Rivera. #LaDiariaJusticia,"{'retweet_count': 0, 'reply_count': 0, 'like_count': 3, 'quote_count': 0}",,
73,103296066,1517240676026572804,2022-04-21 20:35:40+00:00,Fiscal de San Carlos archivó investigación por construcción de caminería en la laguna José Ignacio. #LaDiariaMaldonado,"{'retweet_count': 0, 'reply_count': 0, 'like_count': 3, 'quote_count': 1}",,
74,103296066,1517237919504871428,2022-04-21 20:24:43+00:00,"Cuatro alcaldes –uno de Montevideo, dos de Canelones y otro de Colonia– fueron llamados por el MEC para oficiar casamientos ante un paro de funcionarios del Registro Civil en Montevideo #LaDiariaTrabajo","{'retweet_count': 1, 'reply_count': 1, 'like_count': 6, 'quote_count': 0}",,
75,103296066,1517235927428612099,2022-04-21 20:16:48+00:00,Sindicato del Registro Civil calificó de “para la tribuna” pedido a alcaldes de venir a casar a Montevideo durante paro de funcionarios. #LaDiariaTrabajo,"{'retweet_count': 1, 'reply_count': 1, 'like_count': 2, 'quote_count': 0}",,
76,103296066,1517233925864701957,2022-04-21 20:08:51+00:00,"En reunión entre ASSE y la federación de salud pública, se descartó en primera instancia privatizar la distribución de los medicamentos #LaDiariaSalud","{'retweet_count': 0, 'reply_count': 0, 'like_count': 2, 'quote_count': 0}",,
77,103296066,1517232007205605378,2022-04-21 20:01:13+00:00,El FA pedirá sumar a causa por el contrato en el puerto el fallo del TCR y cree que demuestra abuso de funciones. #LaDiariaJusticia,"{'retweet_count': 1, 'reply_count': 0, 'like_count': 2, 'quote_count': 1}",,
78,103296066,1517229593048064000,2022-04-21 19:51:38+00:00,Universidad Tres de Febrero de Argentina llama a una beca de posgrado para residentes en Uruguay #LaDiariaEducación,"{'retweet_count': 0, 'reply_count': 0, 'like_count': 0, 'quote_count': 0}",,
79,103296066,1517227431685505026,2022-04-21 19:43:03+00:00,Aumenta el precio de todos los cortes de carne vacuna entre 12 y 15 pesos por kilo. #LaDiariaEconomía,"{'retweet_count': 2, 'reply_count': 1, 'like_count': 4, 'quote_count': 2}",,
80,103296066,1517225113082548224,2022-04-21 19:33:50+00:00,La LUC y el Sí rosado: la ley y la justicia. La #postura de Miguel Aguirre Bayley,"{'retweet_count': 0, 'reply_count': 0, 'like_count': 1, 'quote_count': 0}",,{'media_keys': ['3_1517225110410870791']}
81,103296066,1517223572351201281,2022-04-21 19:27:42+00:00,Darío Pérez aceptó la propuesta de la Intendencia de Maldonado para coordinar un plan piloto de tratamiento y prevención de adicciones,"{'retweet_count': 0, 'reply_count': 0, 'like_count': 2, 'quote_count': 4}",,
82,103296066,1517222494104657920,2022-04-21 19:23:25+00:00,"Tras reunión con el MTSS, PIT-CNT confirmó que aumentos que anunció el gobierno son “insuficientes”","{'retweet_count': 0, 'reply_count': 0, 'like_count': 3, 'quote_count': 0}",,
83,103296066,1517220675609677828,2022-04-21 19:16:12+00:00,SCJ archivó la causa por filtración en el despacho del expresidente Tabaré Sosa. #LaDiariaJusticia,"{'retweet_count': 0, 'reply_count': 0, 'like_count': 0, 'quote_count': 0}",,
84,103296066,1517218621545721857,2022-04-21 19:08:02+00:00,Funcionarios de Primaria reclaman la contratación de 600 auxiliares de servicio y apuestan a la Rendición de Cuentas. #LaDiariaEducación,"{'retweet_count': 2, 'reply_count': 0, 'like_count': 4, 'quote_count': 0}",,
85,103296066,1517216209699287040,2022-04-21 18:58:27+00:00,Operación Maléfica 2: 21 detenidos por presunta vinculación con el narcotráfico. #LaDiariaColonia,"{'retweet_count': 0, 'reply_count': 1, 'like_count': 0, 'quote_count': 0}",,
86,103296066,1517214268046950401,2022-04-21 18:50:44+00:00,El mal momento de Netflix: cae el número de suscriptores y debaten las causas,"{'retweet_count': 1, 'reply_count': 0, 'like_count': 3, 'quote_count': 1}",,
87,103296066,1517212646495432706,2022-04-21 18:44:18+00:00,"Formalizaron con prisión preventiva a una mujer que intentó ingresar 21,40 gramos de marihuana a Las Rosas. #LaDiariaMaldonado","{'retweet_count': 0, 'reply_count': 0, 'like_count': 3, 'quote_count': 1}",,
88,103296066,1517210834715488262,2022-04-21 18:37:06+00:00,"Maldonado y Flores tienen la tasa de actividad más alta y Tacuarembó la más baja, según nuevo informe trimestral del INE","{'retweet_count': 0, 'reply_count': 0, 'like_count': 0, 'quote_count': 0}",,
89,103296066,1517208782635479040,2022-04-21 18:28:56+00:00,"En un escenario signado por la pandemia y la guerra, y ante el riesgo latente de una estanflación, los responsables de las políticas están tomando conciencia de las limitaciones de sus propias herramientas. #LaDiariaEconomía","{'retweet_count': 0, 'reply_count': 0, 'like_count': 4, 'quote_count': 0}",,
90,103296066,1517206925603180545,2022-04-21 18:21:34+00:00,"Marcelo Abdala sobre aumento de salarios en julio: “No existe el ajuste, es un vale”.","{'retweet_count': 1, 'reply_count': 0, 'like_count': 5, 'quote_count': 0}",,
91,103296066,1517204556706467840,2022-04-21 18:12:09+00:00,"Ante la inminente caída de Mariúpol, Ucrania propuso a Rusia negociar para salvar las vidas de los militares y civiles que aún están en la ciudad.","{'retweet_count': 1, 'reply_count': 1, 'like_count': 5, 'quote_count': 0}",,
92,103296066,1517202516039151616,2022-04-21 18:04:02+00:00,Tenencia de armas: se aprobó en comisión una nueva prórroga de la fiscalización.,"{'retweet_count': 1, 'reply_count': 0, 'like_count': 0, 'quote_count': 0}",,
93,103296066,1517200388759379969,2022-04-21 17:55:35+00:00,Operación Maléfica 2: 21 detenidos por presunta vinculación con el narcotráfico #LaDiariaColonia,"{'retweet_count': 0, 'reply_count': 0, 'like_count': 1, 'quote_count': 0}",,
94,103296066,1517198576316731394,2022-04-21 17:48:23+00:00,Funcionarios de Primaria reclaman la contratación de 600 auxiliares de servicio y apuestan a la Rendición de Cuentas #LaDiariaEducación,"{'retweet_count': 0, 'reply_count': 0, 'like_count': 2, 'quote_count': 0}",,
95,103296066,1517196130425217030,2022-04-21 17:38:40+00:00,Aumenta el precio de todos los cortes de carne vacuna entre 12 y 15 pesos por kilo #LaDiariaEconomía,"{'retweet_count': 1, 'reply_count': 0, 'like_count': 3, 'quote_count': 5}",,
96,103296066,1517193820089237504,2022-04-21 17:29:29+00:00,"Para Astori las medidas que tomó el gobierno son “absolutamente insuficientes”, pero no aumentarán la inflación","{'retweet_count': 1, 'reply_count': 0, 'like_count': 1, 'quote_count': 0}",,
97,103296066,1517192613295792135,2022-04-21 17:24:41+00:00,“Una crisis encima de otra”: el complejo panorama que visualiza el Fondo Monetario Internacional #LaDiariaEconomía,"{'retweet_count': 0, 'reply_count': 0, 'like_count': 2, 'quote_count': 0}",,
98,103296066,1517190303450550277,2022-04-21 17:15:31+00:00,Playoffs de la Liga Uruguaya de Básquetbol: el clásico de otoño,"{'retweet_count': 0, 'reply_count': 0, 'like_count': 0, 'quote_count': 0}",,
99,103296066,1517187692236353536,2022-04-21 17:05:08+00:00,"Disidencias corporales en bicicleta, limpieza costera e intercambios sobre migración en la agenda semanal","{'retweet_count': 0, 'reply_count': 0, 'like_count': 0, 'quote_count': 0}",,
