,author_id,tweet_id,time,text,metrics,tweet_url,images
0,186183080,1530683528681234432,2022-05-28 22:52:46+00:00,Bautismo del buque Expreso del Plata e inauguración de Líneas del Plata que brindará un gran servicio logístico al transportar camiones con carga desde el Puerto de Juan Lacaze hasta el de Bs. As. Entre otros beneficios ayudará a descongestionar los puentes sobre el Río Uruguay,"{'retweet_count': 12, 'reply_count': 2, 'like_count': 39, 'quote_count': 0}",,"{'media_keys': ['3_1530682028995362816', '3_1530682028986884096', '3_1530683037352177668', '3_1530682029112627201']}"
1,186183080,1530603692545568769,2022-05-28 17:35:32+00:00,"A través de la gastronomía expresamos la cultura de un país, de una región.  vía","{'retweet_count': 4, 'reply_count': 0, 'like_count': 5, 'quote_count': 0}",,
2,186183080,1530289684773056512,2022-05-27 20:47:46+00:00,Video del lanzamiento de la agenda anual de eventos de la Asociación Uruguaya de Asadores,"{'retweet_count': 3, 'reply_count': 0, 'like_count': 4, 'quote_count': 0}",,{'media_keys': ['7_1530289614656790531']}
3,186183080,1530266086695763968,2022-05-27 19:14:00+00:00,Presentación de la agenda anual de eventos de la Asociación Uruguaya de Asadores participamos junto al Subsecretario  y al Presidente de AUA Enrique Puentes.,"{'retweet_count': 8, 'reply_count': 2, 'like_count': 33, 'quote_count': 0}",,"{'media_keys': ['3_1530266076365430787', '3_1530266076365340674', '3_1530266076365443078', '3_1530266076382171137']}"
4,186183080,1529806450201186306,2022-05-26 12:47:34+00:00,Primer “Foro Uruguay Sustentable”  vía,"{'retweet_count': 3, 'reply_count': 0, 'like_count': 9, 'quote_count': 0}",,
5,186183080,1529802160015294465,2022-05-26 12:30:31+00:00,,"{'retweet_count': 2, 'reply_count': 0, 'like_count': 5, 'quote_count': 0}",,
6,186183080,1529474620792770560,2022-05-25 14:49:00+00:00,"🌿Junto a la Vicepresidenta   el Ministro  y autoridades, se realiza el lanzamiento de la primera edición de #ExpoUruguaySostenible en el Salón de Eventos Especiales del  Es muy importante para el turismo un País Sostenible","{'retweet_count': 9, 'reply_count': 0, 'like_count': 36, 'quote_count': 0}",,"{'media_keys': ['3_1529474608067448832', '3_1529474608067497985', '3_1529474608080068609', '3_1529474608503697408']}"
7,186183080,1529148303841153025,2022-05-24 17:12:20+00:00,Conferencia sobre el Congreso de Turismo Religioso y Sustentable que se realizará en Paysandú del 9 al 11 de junio. Participamos junto al Subsecretario  Dir Nac  Dir de Turismo   y Org.Rosario Bianco,"{'retweet_count': 5, 'reply_count': 0, 'like_count': 17, 'quote_count': 0}",,"{'media_keys': ['3_1529148293288173568', '3_1529148293288181762']}"
