,author_id,tweet_id,time,text,metrics,tweet_url,images
0,2350658317,1520476838245453824,2022-04-30 18:55:01+00:00,"En este d칤a tan especial queremos saludar a aquellos que est치n d칤a a d칤a detr치s de la producci칩n. 

춰Feliz d칤a a todos los que mueven la rueda por y para el Pa칤s! 游뚶","{'retweet_count': 17, 'reply_count': 4, 'like_count': 23, 'quote_count': 1}",,{'media_keys': ['3_1520476832512024577']}
1,2350658317,1518683042600001536,2022-04-25 20:07:07+00:00,"La lucha contra el abuso y maltrato en NNA fue, es y seguir치 siendo una bandera de nuestra juventud. Seguiremos trabajando para disminuir estos datos y defender a quienes no se pueden defender por si mismos. 

#SigamosHaciendoHistoria","{'retweet_count': 5, 'reply_count': 0, 'like_count': 7, 'quote_count': 0}",,
2,2350658317,1518683040934813696,2022-04-25 20:07:07+00:00,"Dicha ley fue propuesta por nuestra juventud en 2020, junto al Dip  que le confiere al SIPIAV la responsabilidad de dise침ar e implementar una campa침a a nivel nacional, para combatir esta problem치tica.游녢游낖","{'retweet_count': 5, 'reply_count': 1, 'like_count': 7, 'quote_count': 0}",,
3,2350658317,1518683038346928128,2022-04-25 20:07:06+00:00,"Para 2022, SIPIAV planifica contar con un plan de trabajo en donde se contemplar치 la respuesta al problema del abuso sexual, de acuerdo a lo establecido en la ley No. 19.903. 游녢游낖","{'retweet_count': 7, 'reply_count': 1, 'like_count': 9, 'quote_count': 0}",,"{'media_keys': ['3_1518683016062717957', '3_1518683016062812161']}"
4,2350658317,1518683013042688001,2022-04-25 20:07:00+00:00,"En cu치nto agresores el 91% son familiares directos o integrantes de n칰cleo de convivencia, y m치s de la mitad corresponden a personas entre 30 y 44 a침os. 游녢游낖","{'retweet_count': 5, 'reply_count': 1, 'like_count': 7, 'quote_count': 0}",,
5,2350658317,1518683010933006336,2022-04-25 20:07:00+00:00,"Las situaciones contin칰an siendo cr칩nicas y recurrentes, teniendo una baja visualizaci칩n por parte de los ni침os, ni침as y adolescentes de las situaciones de violencia vividas. 
Hay un mayor grado de visibilizacion en sexo femenino que masculino.游녢游낖","{'retweet_count': 5, 'reply_count': 1, 'like_count': 7, 'quote_count': 0}",,
6,2350658317,1518683009536327682,2022-04-25 20:06:59+00:00,"Tipos de violencia registrados:

游녤游낖37% Maltrato emocional
游녤游낖24% Negligencia
游녤游낖20% Abuso Sexual
游녤游낖17% Maltrato F칤sico 
游녤游낖2% Explotaci칩n sexual","{'retweet_count': 5, 'reply_count': 1, 'like_count': 8, 'quote_count': 0}",,
7,2350658317,1518683007967653888,2022-04-25 20:06:59+00:00,"El 56% de las situaciones registradas corresponden a ni침os, ni침as y adolescentes con 12 a침os o menos, destac치ndose el 19% menores a 5 a침os. 

Tambien, un 55% corresponde a ni침as o adolescentes mujeres. 游녢游낖","{'retweet_count': 5, 'reply_count': 1, 'like_count': 7, 'quote_count': 0}",,
8,2350658317,1518683006331809792,2022-04-25 20:06:59+00:00,"DIA INTERNACIONAL CONTRA EL MALTRATO Y ABUSO SEXUAL DE NI칌AS, NI칌OS Y ADOLESCENTES.

Seg칰n datos del  a traves del SIPIAV, en 2021 se detectaron un total de 7035 NNA que vivieron situaciones de violencia. Dentro de este total, 2882 son situaciones nuevas.游녢游낖","{'retweet_count': 22, 'reply_count': 2, 'like_count': 30, 'quote_count': 0}",,
9,2350658317,1518349413634109441,2022-04-24 22:01:24+00:00,"Hoy recordamos los 107 a침os del Genocidio Armenio reafirmando la necesidad de que se haga justicia hacia el pueblo Armenio, reconociendo dicho episodio como una de las barbaries del siglo XX.","{'retweet_count': 31, 'reply_count': 3, 'like_count': 85, 'quote_count': 1}",,
