,author_id,tweet_id,time,text,metrics,tweet_url,images
0,135042862,1520720140286844928,2022-05-01 11:01:49+00:00,"Para los que trabajan con las manos, para los que trabajan con su cabeza, para los que dejan el alma y el corazón , para los que sueñan y se esfuerzan día a día en construir un mejor Uruguay. 
Muy feliz día para todos los trabajadores. https://t.co/NVM8EmWupR","{'retweet_count': 17, 'reply_count': 11, 'like_count': 101, 'quote_count': 0}",https://twitter.com/i/web/status/1520720140286844928,{'media_keys': ['3_1520720133718687744']}
1,135042862,1520406130739924997,2022-04-30 14:14:04+00:00,"Al trabajador rural que día a día, con calor o frío, con seca o inundación, derrochando madrugadas y agotadoras jornadas, es capaz de transformar a su esfuerzo en recursos para todos los uruguayos, vaya en su día nuestro homenaje, agradecimiento y reconocimiento…
Salud!! https://t.co/Wwcvk7lmnF","{'retweet_count': 26, 'reply_count': 27, 'like_count': 106, 'quote_count': 3}",https://twitter.com/i/web/status/1520406130739924997,{'media_keys': ['3_1520406122016002049']}
2,135042862,1519824707062689792,2022-04-28 23:43:41+00:00,En la tarde firmamos con los vecinos de #Artigas casi medio millar de préstamos para autoconstrucción en terreno propio. Es una alegría inmensa que se de inicio a este camino para que más uruguayos alcancen el sueño de su casa propia. https://t.co/hXGsTTP5fp,"{'retweet_count': 8, 'reply_count': 10, 'like_count': 49, 'quote_count': 1}",https://twitter.com/i/web/status/1519824707062689792,
3,135042862,1519800978538569728,2022-04-28 22:09:24+00:00,En el día de hoy  trece familias lograron el sueño de su casa propia. Mis felicitaciones a ellos! Seguimos trabajando #entretodos para que más uruguayos alcancen este objetivo! Vamos por más! 😀😀 https://t.co/U1oOm23POS,"{'retweet_count': 17, 'reply_count': 12, 'like_count': 59, 'quote_count': 0}",https://twitter.com/i/web/status/1519800978538569728,
4,135042862,1519449752030621701,2022-04-27 22:53:45+00:00,Mis felicitaciones a todos los integrantes de la Agencia Nacional de Viviendas en su aniversario. Por muchos años más! https://t.co/fPCxwzZ2BT,"{'retweet_count': 8, 'reply_count': 4, 'like_count': 34, 'quote_count': 0}",https://twitter.com/i/web/status/1519449752030621701,
