,author_id,tweet_id,time,text,metrics,tweet_url,images
0,262799898,1520458439264129025,2022-04-30 17:41:55+00:00,"Por compartir el mensaje y en recuerdo del viejo, gran hincha del","{'retweet_count': 16, 'reply_count': 1, 'like_count': 52, 'quote_count': 0}",,
1,262799898,1519829085429641217,2022-04-29 00:01:05+00:00,"En el acto en memoria de las v칤ctimas del holocausto del pueblo jud칤o, al que asiste el presidente  organizado por el Comit칠 Central Israelita del Uruguay.","{'retweet_count': 33, 'reply_count': 5, 'like_count': 166, 'quote_count': 1}",,"{'media_keys': ['3_1519829067649982465', '3_1519829067637399554', '3_1519829067658321920', '3_1519829067633242112']}"
2,262799898,1519347036880924672,2022-04-27 16:05:36+00:00,"Compartiendo el aniversario n칰mero 15 de la  junto a su directorio, la ministra de Vivienda  y funcionarios de la agencia.","{'retweet_count': 17, 'reply_count': 9, 'like_count': 52, 'quote_count': 1}",,"{'media_keys': ['3_1519347027393585153', '3_1519347027435470850']}"
3,262799898,1519321074772586496,2022-04-27 14:22:26+00:00,"En el  donde asistimos a la Comisi칩n de Legislaci칩n del Trabajo y Seguridad Social de Diputados, para tratar un proyecto que resuelve un problema de vac칤o legal que afecta a un grupo de efectivos y funcionarios con discapacidad.","{'retweet_count': 19, 'reply_count': 1, 'like_count': 61, 'quote_count': 0}",,"{'media_keys': ['3_1519321062370066433', '3_1519321062365966339', '3_1519321062407909378']}"
4,262799898,1519072562503946241,2022-04-26 21:54:56+00:00,"En el acto de conmemoraci칩n del 107 aniversario del Genocidio Armenio, que se realiza en el  y al que asiste el presidente","{'retweet_count': 23, 'reply_count': 4, 'like_count': 127, 'quote_count': 2}",,"{'media_keys': ['3_1519072538667757570', '3_1519072538705465345']}"
5,262799898,1518580187281211394,2022-04-25 13:18:25+00:00,"En el Instituto Militar de Estudios Superiores (IMES), asistiendo a una conferencia sobre ciberseguridad.","{'retweet_count': 20, 'reply_count': 15, 'like_count': 108, 'quote_count': 2}",,"{'media_keys': ['3_1518580175209910273', '3_1518580175243554819']}"
6,262799898,1518191456048934912,2022-04-24 11:33:44+00:00,"A toda la colectividad armenia en Uruguay, como todo 24 de abril, mi solidaridad y cercan칤a con su pueblo, v칤ctima tr치gica de la irracionalidad, la persecuci칩n y el genocidio.  游뷣릖 游쥟릖","{'retweet_count': 113, 'reply_count': 64, 'like_count': 850, 'quote_count': 8}",,
