,author_id,tweet_id,time,text,metrics,tweet_url,images
0,262799898,1520729613009227776,2022-05-01 11:39:28+00:00,"Saludo a todos a los trabajadores, a los que con esfuerzo construyen y dignifican nuestra comunidad nacional. Feliz día!","{'retweet_count': 54, 'reply_count': 51, 'like_count': 580, 'quote_count': 4}",https://twitter.com/i/web/status/1520729613009227776,
1,262799898,1520458439264129025,2022-04-30 17:41:55+00:00,"Por compartir el mensaje y en recuerdo del viejo, gran hincha del @Atleti https://t.co/QROEJRu88H","{'retweet_count': 19, 'reply_count': 1, 'like_count': 60, 'quote_count': 0}",https://twitter.com/i/web/status/1520458439264129025,
2,262799898,1519829085429641217,2022-04-29 00:01:05+00:00,"En el acto en memoria de las víctimas del holocausto del pueblo judío, al que asiste el presidente @LuisLacallePou organizado por el Comité Central Israelita del Uruguay. https://t.co/jMzo5xHh6n","{'retweet_count': 34, 'reply_count': 5, 'like_count': 169, 'quote_count': 1}",https://twitter.com/i/web/status/1519829085429641217,"{'media_keys': ['3_1519829067649982465', '3_1519829067637399554', '3_1519829067658321920', '3_1519829067633242112']}"
3,262799898,1519347036880924672,2022-04-27 16:05:36+00:00,"Compartiendo el aniversario número 15 de la @ANV_Uruguay junto a su directorio, la ministra de Vivienda @IreneMoreiraUy y funcionarios de la agencia. https://t.co/tSPLgCPwkd","{'retweet_count': 17, 'reply_count': 9, 'like_count': 52, 'quote_count': 1}",https://twitter.com/i/web/status/1519347036880924672,"{'media_keys': ['3_1519347027393585153', '3_1519347027435470850']}"
4,262799898,1519321074772586496,2022-04-27 14:22:26+00:00,"En el @ParlamentoUY donde asistimos a la Comisión de Legislación del Trabajo y Seguridad Social de Diputados, para tratar un proyecto que resuelve un problema de vacío legal que afecta a un grupo de efectivos y funcionarios con discapacidad. https://t.co/e6dT1N97hQ","{'retweet_count': 19, 'reply_count': 1, 'like_count': 62, 'quote_count': 0}",https://twitter.com/i/web/status/1519321074772586496,"{'media_keys': ['3_1519321062370066433', '3_1519321062365966339', '3_1519321062407909378']}"
5,262799898,1519072562503946241,2022-04-26 21:54:56+00:00,"En el acto de conmemoración del 107 aniversario del Genocidio Armenio, que se realiza en el @ParlamentoUY, y al que asiste el presidente @LuisLacallePou https://t.co/Y0A4c1zjg3","{'retweet_count': 23, 'reply_count': 4, 'like_count': 128, 'quote_count': 2}",https://twitter.com/i/web/status/1519072562503946241,"{'media_keys': ['3_1519072538667757570', '3_1519072538705465345']}"
