,author_id,tweet_id,time,text,metrics,tweet_url,images
0,321686712,1518414393569988609,2022-04-25 02:19:36+00:00,"El triunfo de Macron es una excelente noticia para el mundo y, en particular, para la afirmación de los ideales democráticos https://t.co/ja4IyVvhcK","{'retweet_count': 11, 'reply_count': 29, 'like_count': 99, 'quote_count': 8}",https://twitter.com/i/web/status/1518414393569988609,
1,321686712,1518331833699680256,2022-04-24 20:51:33+00:00,Hago llegar mi saludo a toda la comunidad de Nueva Helvecia al cumplirse los 160 años. Un gran ejemplo de comunidad trabajadora e integrada. https://t.co/NJIWu4o161,"{'retweet_count': 7, 'reply_count': 3, 'like_count': 50, 'quote_count': 0}",https://twitter.com/i/web/status/1518331833699680256,
2,321686712,1518331371202265091,2022-04-24 20:49:42+00:00,Total apoyo a la excelente gestión de @MnicaBottero al frente de @inmujeres_uy  Lamento y rechazo los ataques infundados. Ladran Sancho… @pindependiente,"{'retweet_count': 24, 'reply_count': 155, 'like_count': 126, 'quote_count': 25}",https://twitter.com/i/web/status/1518331371202265091,
3,321686712,1518330459318591488,2022-04-24 20:46:05+00:00,En la conmemoración de un nuevo aniversario del Genocidio Armenio hago llegar mi saludo a toda la colectividad armenia. Y mi rechazo a toda expresión de racismo y xenofobia,"{'retweet_count': 23, 'reply_count': 6, 'like_count': 144, 'quote_count': 0}",https://twitter.com/i/web/status/1518330459318591488,
4,321686712,1517615327277891587,2022-04-22 21:24:24+00:00,Se convocó a las mesas de los sectores de trabajadores públicos trasmitiendo la decisión del Poder Ejecutivo de aumentar a partir de julio un 2% a cuenta de los aumentos de diciembre próximo para evitar caída del poder adquisitivo del salario https://t.co/gVWKarEJIx,"{'retweet_count': 12, 'reply_count': 5, 'like_count': 44, 'quote_count': 0}",https://twitter.com/i/web/status/1517615327277891587,
5,321686712,1516983540998713345,2022-04-21 03:33:55+00:00,Excelente espacio de diálogo y reflexión promovido por @kasmontevideo y organizado por Fito Garcé y @fernandaboidi son la participación política de las mujeres. Muchas gracias por la invitación https://t.co/729g9MwsBc,"{'retweet_count': 2, 'reply_count': 0, 'like_count': 10, 'quote_count': 1}",https://twitter.com/i/web/status/1516983540998713345,
6,321686712,1516918597670428673,2022-04-20 23:15:51+00:00,Un muy buen intercambio con tres excelentes periodistas https://t.co/AyUTniw9Ut,"{'retweet_count': 1, 'reply_count': 0, 'like_count': 16, 'quote_count': 0}",https://twitter.com/i/web/status/1516918597670428673,
7,321686712,1516207163751866382,2022-04-19 00:08:52+00:00,"Seguimos comprometidos en la recuperación del poder adquisitivo del salario de los trabajadores. A pesar de la inflación mundial que nos golpea, hemos tomado medidas para defender el poder adquisitivo de los trabajadores y jubilados.","{'retweet_count': 54, 'reply_count': 134, 'like_count': 359, 'quote_count': 14}",https://twitter.com/i/web/status/1516207163751866382,
8,321686712,1516206219475623938,2022-04-19 00:05:07+00:00,"Para enfrentar la inflación, resolvimos aumentar los salarios públicos 2% y jubilaciones y pensiones 3% a partir de julio y sugerir a los Consejos de Salarios del sector privado que ajusten por inflación en este año. El objetivo es recuperar el poder adquisitivo del salario","{'retweet_count': 156, 'reply_count': 581, 'like_count': 1227, 'quote_count': 111}",https://twitter.com/i/web/status/1516206219475623938,
