,author_id,tweet_id,time,text,metrics,tweet_url,images
0,153146271,1524141359438962689,2022-05-10 21:36:31+00:00,"Presentan Plan Nacional de Invierno sumando nuevos servicios de atenci贸n.
El MIDES trabaja en articulaci贸n con las intendencias a trav茅s de los CECOED, SINAE, ASSE, INAU, el Ministerio de Defensa Nacional y el Ministerio del Interior.

 Le茅 m谩s en https://t.co/cfn9XgPdyL https://t.co/LMPYkdNQ9M","{'retweet_count': 5, 'reply_count': 1, 'like_count': 18, 'quote_count': 1}",https://twitter.com/i/web/status/1524141359438962689,{'media_keys': ['3_1524141357996068870']}
1,153146271,1524101006962872321,2022-05-10 18:56:11+00:00,"Raffo afirm贸 ""La intendenta anunci贸 lo que nosotros ven铆amos proponiendo hace 8 meses"".
La dirigente nacionalista remarc贸 que su partido ""hist贸ricamente ha votado el saneamiento de Montevideo"".

 Le茅 m谩s en https://t.co/pRixKydlP7 https://t.co/4RSALgbUCJ","{'retweet_count': 19, 'reply_count': 9, 'like_count': 73, 'quote_count': 0}",https://twitter.com/i/web/status/1524101006962872321,{'media_keys': ['3_1524101005687898115']}
2,153146271,1524100419215147010,2022-05-10 18:53:51+00:00,"Proyecto de Botana y Camy, busca soluci贸n a situaci贸n de deudores BHU.
La Comisi贸n de Vivienda del Senado buscar谩 hoy unificar las propuestas para dar soluci贸n a los deudores del Banco Hipotecario.

 Le茅 m谩s en https://t.co/XcjInbmQk5 https://t.co/SdQRSz7sYs","{'retweet_count': 9, 'reply_count': 1, 'like_count': 15, 'quote_count': 0}",https://twitter.com/i/web/status/1524100419215147010,{'media_keys': ['3_1524100417021517833']}
3,153146271,1524099972991492100,2022-05-10 18:52:04+00:00,"Alcaldesa Matilde Ant铆a, rinde cuentas de gesti贸n.
presentar谩 la evaluaci贸n anual, el cumplimiento de los planes de desarrollo previstos y el plan de acci贸n pr贸ximo.

 https://t.co/FLVJKtwsg6
 Le茅 m谩s en https://t.co/lj4CxAkfyN https://t.co/dblDD3DLzS","{'retweet_count': 4, 'reply_count': 0, 'like_count': 12, 'quote_count': 0}",https://twitter.com/i/web/status/1524099972991492100,{'media_keys': ['3_1524099971645165570']}
4,153146271,1524099290867679234,2022-05-10 18:49:21+00:00,"Mujeres Rurales acceden a capacitaci贸n tecnol贸gica.
Maldonado, del Plan Nacional de G茅nero en las Pol铆ticas Agropecuarias, hizo entrega de 140 equipos de computaci贸n para capacitar a mujeres rurales de 18 departamentos.

 MGAP
 Le茅 m谩s en https://t.co/zBaxLrUAxX https://t.co/YnmCN541zX","{'retweet_count': 7, 'reply_count': 0, 'like_count': 20, 'quote_count': 2}",https://twitter.com/i/web/status/1524099290867679234,{'media_keys': ['3_1524099289072521218']}
5,153146271,1523775011449933825,2022-05-09 21:20:47+00:00,"Mujeres pol铆ticas en formaci贸n.

SEMINARIO DE NEGOCIACIN Y ESTRATEGIA 

Martes 17 de mayo - 18 hs. 
Club Uruguay (Sarand铆 584)

LINK DE INSCRIPCIN 
https://t.co/MWhjIK0bTr https://t.co/0JsGZRu0IS","{'retweet_count': 8, 'reply_count': 0, 'like_count': 16, 'quote_count': 0}",https://twitter.com/i/web/status/1523775011449933825,{'media_keys': ['3_1523775009893896192']}
6,153146271,1523772145813360642,2022-05-09 21:09:24+00:00,"Sesion贸 el Directorio del Partido Nacional presidido por Iturralde.
En la agenda de trabajo se analizaron los pr贸ximos asuntos partidarios.

 Le茅 m谩s en https://t.co/FyjNKArvKi https://t.co/9bpSusMJfO","{'retweet_count': 8, 'reply_count': 0, 'like_count': 18, 'quote_count': 0}",https://twitter.com/i/web/status/1523772145813360642,{'media_keys': ['3_1523772143900712960']}
7,153146271,1523771218645725184,2022-05-09 21:05:43+00:00,"La elecci贸n de j贸venes ser谩 el primero de octubre.
La Comisi贸n Nacional de la Juventud, anunci贸 una gira por todo el pa铆s para informar sobre la nueva instancia electoral

 Le茅 m谩s en https://t.co/xyFHV1PlXW https://t.co/5OYDtAPZbo","{'retweet_count': 12, 'reply_count': 0, 'like_count': 29, 'quote_count': 1}",https://twitter.com/i/web/status/1523771218645725184,{'media_keys': ['3_1523771216959610880']}
8,153146271,1523771018422145025,2022-05-09 21:04:55+00:00,"La elecci贸n de j贸venes ser谩 el primero de octubre.
La Comisi贸n Nacional de la Juventud, anunci贸 una gira por todo el pa铆s para informar sobre la nueva instancia electoral

 Le茅 m谩s en https://t.co/xyFHV1PlXW https://t.co/DwkS5UHL0Q","{'retweet_count': 8, 'reply_count': 0, 'like_count': 37, 'quote_count': 1}",https://twitter.com/i/web/status/1523771018422145025,{'media_keys': ['3_1523771016916484099']}
9,153146271,1523770179762671618,2022-05-09 21:01:35+00:00,"Extienden rebaja de 9% de IVA para las actividades tur铆sticas.
El MEF decidi贸 la pr贸rroga por cuarta vez como medida de apoyo al sector en la etapa de reactivaci贸n econ贸mica posterior a la pandemia.

 Le茅 m谩s en https://t.co/Dai7qyt6dO https://t.co/QZVvy690kP","{'retweet_count': 13, 'reply_count': 3, 'like_count': 32, 'quote_count': 0}",https://twitter.com/i/web/status/1523770179762671618,{'media_keys': ['3_1523770178382831618']}
10,153146271,1523769273289777152,2022-05-09 20:57:59+00:00,"Realizaron el Congreso Nacional de Ediles en Paysand煤.
Las comisiones de trabajo presentaron sus informes que ser谩n trasladados a los distintos ministros para su consideraci贸n.

 Le茅 m谩s en https://t.co/7bxKPSQfBG https://t.co/aUYx3zJGhc","{'retweet_count': 4, 'reply_count': 0, 'like_count': 12, 'quote_count': 0}",https://twitter.com/i/web/status/1523769273289777152,{'media_keys': ['3_1523769271259648006']}
11,153146271,1523694851493093376,2022-05-09 16:02:16+00:00,AHORA | Directorio del @PNACIONAL sesiona en Casa del Partido. Importante agenda de trabajo en el mes de mayo. https://t.co/ZfGtpdwAGV,"{'retweet_count': 25, 'reply_count': 14, 'like_count': 93, 'quote_count': 0}",https://twitter.com/i/web/status/1523694851493093376,"{'media_keys': ['3_1523694849542836227', '3_1523694849542795264']}"
12,153146271,1522640356810047492,2022-05-06 18:12:05+00:00,"Desde hoy sesiona en Paysand煤 el Congreso Nacional de Ediles.
Esta nueva instancia de dialogo convoca a los 31 curules de los 19 departamentos del pa铆s, y se extiende desde hoy hasta el domingo 8.

 Intendencia de Paysand煤
 Le茅 m谩s en https://t.co/VCXAgpUZUm https://t.co/sE64VExxW4","{'retweet_count': 8, 'reply_count': 2, 'like_count': 24, 'quote_count': 0}",https://twitter.com/i/web/status/1522640356810047492,{'media_keys': ['3_1522640355572731905']}
13,153146271,1522638896567308289,2022-05-06 18:06:16+00:00,"Inician campa帽a rumbo a la elecci贸n de j贸venes.
Integrantes y candidatos de la juventud 404, compartieron experiencias con referentes partidarios que actualmente ocupan cargos de responsabilidad gubernamental.

 Le茅 m谩s en https://t.co/6IsNViW20i https://t.co/Dbq6b5jyin","{'retweet_count': 12, 'reply_count': 4, 'like_count': 49, 'quote_count': 0}",https://twitter.com/i/web/status/1522638896567308289,{'media_keys': ['3_1522638895283847168']}
14,153146271,1522637081377484800,2022-05-06 17:59:04+00:00,"Inauguran importantes obras en el Municipio de Ismael Cortinas.
Ismael Cortinas cuenta con a partir de ahora con su Parque Municipal totalmente renovado y equipado para el disfrute de toda la poblaci贸n.

 Le茅 m谩s en https://t.co/gFhI7ZORjf https://t.co/41CD1XI1Yd","{'retweet_count': 4, 'reply_count': 1, 'like_count': 11, 'quote_count': 1}",https://twitter.com/i/web/status/1522637081377484800,{'media_keys': ['3_1522637080106569728']}
15,153146271,1522636673732993024,2022-05-06 17:57:26+00:00,"Besozzi y Falero recorren obras p煤blicas en Soriano.
Visitar谩n construcciones en las localidades de Ega帽a, Dolores y Mercedes.

 Le茅 m谩s en https://t.co/ltyZpuQoWK https://t.co/ECwEJBiW8i","{'retweet_count': 4, 'reply_count': 0, 'like_count': 8, 'quote_count': 0}",https://twitter.com/i/web/status/1522636673732993024,"{'media_keys': ['3_1522636671711330304', '3_1522636671749169152']}"
16,153146271,1522381073757442050,2022-05-06 01:01:47+00:00,"El Partido Nacional recibi贸 a autoridades de Eduy21

El presidente, @IturraldeVPablo junto a la Sec. del Partido Nacional @MacarenaRubioF y el director de Educaci贸n @BaroniGonzalo se reunieron con referentes t茅cnicos de la organizaci贸n educativa @eduy21.

https://t.co/5K0ExhQPVI https://t.co/hIKAQjCCLj","{'retweet_count': 7, 'reply_count': 2, 'like_count': 30, 'quote_count': 0}",https://twitter.com/i/web/status/1522381073757442050,{'media_keys': ['3_1522381071861624832']}
17,153146271,1522276095680200705,2022-05-05 18:04:38+00:00,"Presentaron un proyecto de ley que regula las agencias de colocaci贸n de empleo.
Fue propuesto por los diputados Radiccioni, Viviano, Ara煤jo, Colman y Echeverr铆a.

 Le茅 m谩s en https://t.co/Q5X0OAGmHX https://t.co/gQIgKGUjak","{'retweet_count': 1, 'reply_count': 1, 'like_count': 6, 'quote_count': 0}",https://twitter.com/i/web/status/1522276095680200705,{'media_keys': ['3_1522276094455558144']}
18,153146271,1522274996588064769,2022-05-05 18:00:16+00:00,"Larra帽aga Vidal asumi贸 la banca del diputado Viviano, durante su licencia anual.
El joven pol铆tico dijo que comparte la idea de que el Partido Nacional ""es m谩s fuerte cuando tiene dos expresiones, dos corrientes"".

 El Pa铆s
 Le茅 m谩s en https://t.co/gLBNwbEZpE https://t.co/cyv0yruFu1","{'retweet_count': 4, 'reply_count': 2, 'like_count': 15, 'quote_count': 0}",https://twitter.com/i/web/status/1522274996588064769,{'media_keys': ['3_1522274994633555971']}
19,153146271,1522273443525578752,2022-05-05 17:54:06+00:00,"Inauguran sistema de videovigilancia en Durazno y Tacuaremb贸.
El nuevo sistema fue cedido por UPM, para reforzar la seguridad y prevenir el delito en Durazno y Paso de los Toros con 110 c谩maras.

 Presidencia de la Rep煤blica
 Le茅 m谩s en https://t.co/7hRw9iFr0S https://t.co/r8lCYZAE9x","{'retweet_count': 6, 'reply_count': 1, 'like_count': 17, 'quote_count': 0}",https://twitter.com/i/web/status/1522273443525578752,{'media_keys': ['3_1522273441579159553']}
20,153146271,1522272590458499077,2022-05-05 17:50:42+00:00,"Presentaron el Plan Nacional de Primera Infancia con mayor inversi贸n y educaci贸n.
La ministra Arbeleche afirm贸 que es el foco del gobierno desde su primer d铆a.

 Presidencia de la Rep煤blica
 Le茅 m谩s en https://t.co/ae0nMRMXgD https://t.co/yKT9jxoagH","{'retweet_count': 11, 'reply_count': 1, 'like_count': 17, 'quote_count': 0}",https://twitter.com/i/web/status/1522272590458499077,{'media_keys': ['3_1522272589082726415']}
21,153146271,1522267684393693186,2022-05-05 17:31:12+00:00,"Argim贸n cerr贸 la conferencia mundial por el D铆a de la Libertad de Prensa.
El evento fue realizado por la UNESCO y el ministerio de Educaci贸n y Cultura en nuestro pa铆s.

 Presidencia de la Rep煤blica
 Le茅 m谩s en https://t.co/n3wWbyQrYY https://t.co/Gq5fgTpbvf","{'retweet_count': 4, 'reply_count': 2, 'like_count': 24, 'quote_count': 0}",https://twitter.com/i/web/status/1522267684393693186,{'media_keys': ['3_1522267682988601344']}
