,author_id,tweet_id,time,text,metrics,tweet_url,images
0,71022645,1518292385163214848,2022-04-24 18:14:47+00:00,La pasta del domingo. #fattoincasa,"{'retweet_count': 0, 'reply_count': 0, 'like_count': 3, 'quote_count': 0}",,{'media_keys': ['7_1518292314325725184']}
1,71022645,1517991855446630400,2022-04-23 22:20:35+00:00,Disfruta amiga. Hermosa,"{'retweet_count': 0, 'reply_count': 0, 'like_count': 2, 'quote_count': 0}",,
2,71022645,1516927243750101001,2022-04-20 23:50:12+00:00,"Hasta el 22 de abril te podés inscribir al taller “Escribir desde el museo” del  Museo de Artes Decorativas. Del 2 al 9 de mayo, a cargo de la artista visual y escritora Magela Ferrero. No tiene costo y las inscripciones se realizan por este mail: artesdecorativas","{'retweet_count': 0, 'reply_count': 0, 'like_count': 2, 'quote_count': 0}",,
3,71022645,1516927238809264128,2022-04-20 23:50:11+00:00,"En la saga del Wordle, ahora hay uno de geografía que te muestra imágenes de una ciudad que tenés que identificar. Prestale atención a los sonidos, el idioma, los carteles. Explordle","{'retweet_count': 0, 'reply_count': 1, 'like_count': 1, 'quote_count': 1}",,
4,71022645,1516927235248242694,2022-04-20 23:50:10+00:00,"Me encantó la película Rinchard Linkater, Apollo 10 1/2 y aunque no lo crean, está buena y está en Netflix! Es animada, no te asustes, hermosa. Sobre la aventura de conquistar el espacio desde su visión de niño que crecía en Houston.","{'retweet_count': 0, 'reply_count': 1, 'like_count': 1, 'quote_count': 0}",,{'media_keys': ['3_1516884294786064384']}
5,71022645,1516927218114568194,2022-04-20 23:50:06+00:00,"“Hasta dónde llega la gente decente cuando está segura de que tiene razón..”. Esta frase dicha por el gran Sam Waterston en la serie The Dropout, disparó el Pícnic! de hoy, del que te comparto unos pocos de los varios piques. Acá podés leerlo entero 🧵","{'retweet_count': 0, 'reply_count': 1, 'like_count': 1, 'quote_count': 0}",,
6,71022645,1516911951133102080,2022-04-20 22:49:26+00:00,Cómooooo? 🤣 Pedile permiso al tiempo x favor,"{'retweet_count': 0, 'reply_count': 0, 'like_count': 1, 'quote_count': 0}",,
7,71022645,1516882452668731393,2022-04-20 20:52:13+00:00,"Por lo que vi en el documental y vi en varias notas, hay mucho de realidad. Siempre debe tener un toque de drama extra. Mirate el docu en HBO Max (que ya lo había recomendado en Pícnic! 🤣)","{'retweet_count': 1, 'reply_count': 2, 'like_count': 1, 'quote_count': 0}",,
8,71022645,1516782757971742726,2022-04-20 14:16:04+00:00,"Spotify prevé que para 2024 casi la mitad de sus ingresos serán por podcasts. Por eso cada vez vas a ver más podcasts de Spotify (paga a los generadores de contenido para que los hagan). En lo personal, cada vez  escucho más el formato en esa plataforma","{'retweet_count': 1, 'reply_count': 0, 'like_count': 5, 'quote_count': 0}",,{'media_keys': ['3_1516782661133639685']}
