,author_id,tweet_id,time,text,metrics,tweet_url,images
0,140034129,1517928729808408577,2022-04-23 18:09:45+00:00,"23 de abril, felicidades, español.","{'retweet_count': 819, 'reply_count': 302, 'like_count': 5059, 'quote_count': 25}",,
1,140034129,1517844395827077120,2022-04-23 12:34:38+00:00,"El trabajo conjunto entre distintas comunidades autónomas tiene grandes frutos. 

Los vecinos de Castilla y León, Castilla-La Mancha y Madrid son testigos:","{'retweet_count': 357, 'reply_count': 146, 'like_count': 1746, 'quote_count': 7}",,
2,140034129,1517079497945792514,2022-04-21 09:55:12+00:00,"A Madrid se viene a pelear, a vivir, a respetarse, a emprender y a conquistar metas en libertad.","{'retweet_count': 1848, 'reply_count': 831, 'like_count': 9154, 'quote_count': 122}",,{'media_keys': ['7_1517079392278745088']}
3,140034129,1517072356988043264,2022-04-21 09:26:50+00:00,"Esto va de lo siguiente: la izquierda pacta con independentistas golpistas o el entorno de ETA, pero el PP sólo puede gobernar con mayoría absoluta.","{'retweet_count': 3101, 'reply_count': 710, 'like_count': 11059, 'quote_count': 157}",,{'media_keys': ['7_1517071618043961344']}
4,140034129,1517064557465853953,2022-04-21 08:55:50+00:00,El juego sucio que siempre utiliza la izquierda.,"{'retweet_count': 5394, 'reply_count': 1559, 'like_count': 19495, 'quote_count': 499}",,{'media_keys': ['13_1517064350317662209']}
5,140034129,1516760000466718723,2022-04-20 12:45:38+00:00,"Con la Ley de Farmacia que proponemos en 

- Todas las farmacias podrán abrir 24 horas. 

- Se podrá dispensar a domicilio a personas con movilidad reducida.","{'retweet_count': 1326, 'reply_count': 420, 'like_count': 6716, 'quote_count': 80}",,{'media_keys': ['3_1516759996356304897']}
6,140034129,1516478806063779854,2022-04-19 18:08:16+00:00,"En la Universidad Complutense de Madrid defendiendo la libertad y la convivencia en todas las facultades españolas, también en Cataluña.

Los jóvenes inconformistas de  nos dan cada día una lección de vida.","{'retweet_count': 1266, 'reply_count': 501, 'like_count': 6508, 'quote_count': 61}",,"{'media_keys': ['3_1516478801882062848', '3_1516478801882103813', '3_1516478801877872647', '3_1516478801882103811']}"
7,140034129,1516378847989665792,2022-04-19 11:31:04+00:00,"Hoy comienza una nueva etapa en Castilla y León donde la prosperidad, el respeto y la libertad serán señas de identidad de políticas tan necesarias en estos momentos. 

Felicidades.","{'retweet_count': 1937, 'reply_count': 1435, 'like_count': 11528, 'quote_count': 179}",,{'media_keys': ['3_1516378843770142723']}
8,140034129,1516009497596252161,2022-04-18 11:03:24+00:00,"Con la primera calculadora de impuestos en España el contribuyente madrileño sabrá exactamente, de su declaración, cuánto paga en sanidad, educación…

Un ejercicio de transparencia que sería bueno implantar en todas las administraciones.","{'retweet_count': 3157, 'reply_count': 1778, 'like_count': 13060, 'quote_count': 457}",,{'media_keys': ['3_1516009492542013441']}
