,author_id,tweet_id,time,text,metrics,tweet_url,images
0,262799898,1517527482370387969,2022-04-22 15:35:20+00:00,"Dimos posesión del Aeropuerto de Rivera al concesionario. Se suma así al Sistema Nacional de Aeropuertos Internacionales. La inversión privada será de USD 13 millones. Modernización, conectividad, descentralización. Obras generarán 150 puestos directos.@AeropuertosUY https://t.co/PK06O5qYkB","{'retweet_count': 28, 'reply_count': 7, 'like_count': 117, 'quote_count': 1}",https://twitter.com/i/web/status/1517527482370387969,"{'media_keys': ['3_1517527468093194242', '3_1517527468097351681', '3_1517527468101541890']}"
1,262799898,1517175731431743488,2022-04-21 16:17:36+00:00,"Esta mañana participamos en el acto conmemorativo del 81 aniversario de la Base Naval de La Paloma, junto al comandante de la @Armada_Uruguay almirante Jorge Wilson https://t.co/34G2UbAHWF","{'retweet_count': 26, 'reply_count': 10, 'like_count': 111, 'quote_count': 0}",https://twitter.com/i/web/status/1517175731431743488,"{'media_keys': ['3_1517175711739559936', '3_1517175711840321536', '3_1517175711743856641', '3_1517175711722840066']}"
2,262799898,1516490774925377539,2022-04-19 18:55:50+00:00,"En el Área de Control Integrado de Fray Bentos, junto al intendente de Río Negro @tufilafluf, agradeciendo el trabajo del personal que cumple diversas tareas en la cabecera del puente gral. San Martín, y que en los últimos días tuvo intensa actividad. https://t.co/BsfDqE3wKt","{'retweet_count': 19, 'reply_count': 1, 'like_count': 80, 'quote_count': 1}",https://twitter.com/i/web/status/1516490774925377539,"{'media_keys': ['3_1516490743644360705', '3_1516490743648604160', '3_1516490743715700746']}"
3,262799898,1516425152204001282,2022-04-19 14:35:04+00:00,"En el acto conmemorativo del 197 aniversario del Desembarco de los 33 Orientales en la playa de La Agraciada, junto al presidente @LuisLacallePou https://t.co/rDW3ooYtVS","{'retweet_count': 42, 'reply_count': 0, 'like_count': 204, 'quote_count': 1}",https://twitter.com/i/web/status/1516425152204001282,"{'media_keys': ['3_1516425137490382868', '3_1516425137519747084', '3_1516425137490481178', '3_1516425137498775558']}"
4,262799898,1516347099683561488,2022-04-19 09:24:55+00:00,"Como en aquel lejano 19 de abril, la libertad sigue siendo el rumbo. En los más difíciles momentos, siempre la libertad. https://t.co/68fNKiPP1z","{'retweet_count': 98, 'reply_count': 38, 'like_count': 624, 'quote_count': 9}",https://twitter.com/i/web/status/1516347099683561488,{'media_keys': ['3_1516347093727817729']}
5,262799898,1515419498907508736,2022-04-16 19:58:58+00:00,"@LISSIDINI1 @solsticia_uy Qué tal Alicia,exactamente  el mismo.El mismo que derivó a la Fiscalía en julio pasado un documento sobre la detención e “interrogatorio”a Roslik que estaba en las oficinas del M Defensa y que pasó desapercibido por años, con lo cual además tomé decisiones drásticas.El mismo, si.","{'retweet_count': 113, 'reply_count': 17, 'like_count': 332, 'quote_count': 8}",https://twitter.com/i/web/status/1515419498907508736,
