,author_id,tweet_id,time,text,metrics,tweet_url,images
0,75852361,1518097355190456320,2022-04-24 05:19:49+00:00,El gesto del canciller turco a los manifestantes de la colectividad armenia fue repugnante. Digno del mayor desprecio.,"{'retweet_count': 120, 'reply_count': 42, 'like_count': 1156, 'quote_count': 4}",https://twitter.com/i/web/status/1518097355190456320,
1,75852361,1517293482003603457,2022-04-22 00:05:30+00:00,"@unnabodesiempre Sí, la canceló él. Tenía derecho. No tiene derecho a mentir. Pero él es así.","{'retweet_count': 0, 'reply_count': 4, 'like_count': 4, 'quote_count': 0}",https://twitter.com/i/web/status/1517293482003603457,
2,75852361,1517291922318106624,2022-04-21 23:59:18+00:00,"@unnabodesiempre Eso puede ser, es opinable. Pero la entrevista la canceló él. Que no mienta.","{'retweet_count': 0, 'reply_count': 7, 'like_count': 1, 'quote_count': 0}",https://twitter.com/i/web/status/1517291922318106624,
3,75852361,1517288163202375680,2022-04-21 23:44:22+00:00,Que cada uno saque sus conclusiones. https://t.co/rvdhCiWaoG,"{'retweet_count': 2, 'reply_count': 17, 'like_count': 37, 'quote_count': 1}",https://twitter.com/i/web/status/1517288163202375680,
4,75852361,1517201422038708224,2022-04-21 17:59:41+00:00,"@edilavarian Tenía un error ortográfico. Ya fue enviado otra vez, corregido.","{'retweet_count': 0, 'reply_count': 2, 'like_count': 3, 'quote_count': 0}",https://twitter.com/i/web/status/1517201422038708224,
5,75852361,1517199721378447360,2022-04-21 17:52:56+00:00,"El edil Víctor Prado ya anunció a sus colegas que no votará a favor del préstamo del BID a la Intendencia de Montevideo, informó el edil colorado @aguirre_leonel.","{'retweet_count': 15, 'reply_count': 5, 'like_count': 94, 'quote_count': 5}",https://twitter.com/i/web/status/1517199721378447360,
6,75852361,1516958187467022337,2022-04-21 01:53:10+00:00,"En Quaraí rescatan de una granja a un hombre que llevaba tres años trabajando sin cobrar, en condiciones de esclavitud.
https://t.co/IlMUsVxGcq","{'retweet_count': 5, 'reply_count': 3, 'like_count': 18, 'quote_count': 0}",https://twitter.com/i/web/status/1516958187467022337,
7,75852361,1516580710332583937,2022-04-20 00:53:12+00:00,Ex militante comunista acusado de colaborar con la dictadura demandará al Estado uruguayo https://t.co/CFWmeO6CrG vía @ladiaria,"{'retweet_count': 7, 'reply_count': 5, 'like_count': 6, 'quote_count': 1}",https://twitter.com/i/web/status/1516580710332583937,
8,75852361,1516362218455150594,2022-04-19 10:25:00+00:00,¿No hay nadie en la radio que le pueda decir al informativista que se dice enclave y no énclave? Ya enclavó tres “énclaves”.,"{'retweet_count': 11, 'reply_count': 29, 'like_count': 195, 'quote_count': 0}",https://twitter.com/i/web/status/1516362218455150594,
