,author_id,tweet_id,time,text,metrics,tweet_url,images
0,135042862,1520406130739924997,2022-04-30 14:14:04+00:00,"Al trabajador rural que día a día, con calor o frío, con seca o inundación, derrochando madrugadas y agotadoras jornadas, es capaz de transformar a su esfuerzo en recursos para todos los uruguayos, vaya en su día nuestro homenaje, agradecimiento y reconocimiento…
Salud!!","{'retweet_count': 25, 'reply_count': 19, 'like_count': 88, 'quote_count': 3}",,{'media_keys': ['3_1520406122016002049']}
1,135042862,1519824707062689792,2022-04-28 23:43:41+00:00,En la tarde firmamos con los vecinos de #Artigas casi medio millar de préstamos para autoconstrucción en terreno propio. Es una alegría inmensa que se de inicio a este camino para que más uruguayos alcancen el sueño de su casa propia.,"{'retweet_count': 8, 'reply_count': 10, 'like_count': 47, 'quote_count': 1}",,
2,135042862,1519800978538569728,2022-04-28 22:09:24+00:00,En el día de hoy  trece familias lograron el sueño de su casa propia. Mis felicitaciones a ellos! Seguimos trabajando #entretodos para que más uruguayos alcancen este objetivo! Vamos por más! 😀😀,"{'retweet_count': 17, 'reply_count': 12, 'like_count': 54, 'quote_count': 0}",,
3,135042862,1519449752030621701,2022-04-27 22:53:45+00:00,Mis felicitaciones a todos los integrantes de la Agencia Nacional de Viviendas en su aniversario. Por muchos años más!,"{'retweet_count': 8, 'reply_count': 4, 'like_count': 33, 'quote_count': 0}",,
4,135042862,1518348187336986625,2022-04-24 21:56:32+00:00,Estuvimos participando junto al Sr. Presidente  y el senador  en los 160 años de #ColoniaSuiza - #NuevaHelvecia . Hermosa jornada!,"{'retweet_count': 21, 'reply_count': 11, 'like_count': 132, 'quote_count': 3}",,"{'media_keys': ['3_1518348172501868545', '3_1518348172451581957', '3_1518348172443193350', '3_1518348172451581960']}"
