,author_id,tweet_id,time,text,metrics,tweet_url,images
0,1350819751,1519158629483655170,2022-04-27 03:36:56+00:00,"UNICEF ADVIERTE SOBRE CAÍDA ""ALARMANTE"" DE VACUNACIÓN EN NIÑOS DE AMÉRICA LATINA","{'retweet_count': 0, 'reply_count': 0, 'like_count': 0, 'quote_count': 0}",,{'media_keys': ['3_1519158618066759681']}
1,1350819751,1519157615821037570,2022-04-27 03:32:54+00:00,INUMET EMITE AVISO A LA POBLACIÓN POR TORMENTAS FUERTES,"{'retweet_count': 0, 'reply_count': 0, 'like_count': 0, 'quote_count': 0}",,{'media_keys': ['3_1519157603196194816']}
2,1350819751,1519152669201420289,2022-04-27 03:13:15+00:00,ALERTA METEOROLÓGICA,"{'retweet_count': 1, 'reply_count': 0, 'like_count': 1, 'quote_count': 0}",,{'media_keys': ['3_1519152476016066562']}
3,1350819751,1518764364836540416,2022-04-26 01:30:16+00:00,INVESTIGADORA DE FENAPES DIO A CONOCER PRESUNTAS IRREGULARIDADES,"{'retweet_count': 0, 'reply_count': 0, 'like_count': 0, 'quote_count': 0}",,{'media_keys': ['3_1518764355856252930']}
4,1350819751,1518718869954781185,2022-04-25 22:29:29+00:00,ANÁLISIS SOBRE OBJETO INCAUTADO POR LA ARMADA CONCLUYÓ QUE ES UN METEORITO,"{'retweet_count': 0, 'reply_count': 0, 'like_count': 0, 'quote_count': 0}",,{'media_keys': ['3_1518718856327532544']}
5,1350819751,1518212133980454912,2022-04-24 12:55:54+00:00,COMENZARON LAS JORNADAS DE CASTRACIONES GRATUITAS DE PERROS Y PERRAS EN PROGRESO,"{'retweet_count': 0, 'reply_count': 0, 'like_count': 0, 'quote_count': 0}",,{'media_keys': ['3_1518212126225149954']}
6,1350819751,1517726478762401795,2022-04-23 04:46:05+00:00,ENTREGA DEL PREMIO CERVANTES SIN LA URUGUAYA CRISTINA PERI ROSSI,"{'retweet_count': 0, 'reply_count': 0, 'like_count': 1, 'quote_count': 0}",,{'media_keys': ['3_1517726471258845184']}
7,1350819751,1517333331159003136,2022-04-22 02:43:51+00:00,REALIZARON GALA DE TANGO EN LA PAZ EN HOMENAJE A CARLOS GILARDONI,"{'retweet_count': 0, 'reply_count': 0, 'like_count': 1, 'quote_count': 0}",,{'media_keys': ['3_1517333087725760512']}
8,1350819751,1516940976950026242,2022-04-21 00:44:46+00:00,"LA 67º REUNIÓN DE LA COMISIÓN REGIONAL DE OMT PARA LAS AMÉRICAS, SE REALIZARÁ EN PUNTA DEL ESTE","{'retweet_count': 0, 'reply_count': 0, 'like_count': 1, 'quote_count': 0}",,{'media_keys': ['3_1516940965352726533']}
